iddepto,nomdepto,idmpio,nompio,codigohabilitacion,nombre,nitsnit,ese,direccion,telefono,najunombre,numerosedeprincipal
11,Bogotá D.C,11001,BOGOTÁ,1100104488,COUNTRY SCAN LTDA,800006509,NO,Carrera 16 A No. 82-37 PISO 2,6449201,Privada,1
11,Bogotá D.C,11001,BOGOTÁ,1100126490,EFI CIENCIA OCUPACIONAL LTDA,900380757,,CARRERA 20 A # 72 09 OFICINA 201,7551993 7551994,Privada,1
11,Bogotá D.C,11001,BOGOTÁ,1100106146,SOCIEDAD DE CIRUGIA OCULAR S A,800231602,NO,AV CLL 134 Nº 7B- 83 Oficina 214,6257723,Privada,1
11,Bogotá D.C,11001,BOGOTÁ,1100127518,OXIVIDAS SAS,900355438,,CRA 12 N. 71 32 OF 702 B,4672265 - 3142954946,Privada,1
11,Bogotá D.C,11001,BOGOTÁ,1100111048,CENTRO DE DIAGNOSTICO Y TRATAMIENTO CENDIATRA SOCIEDAD POR ACCIONES SIMPLIFICADAS CENDIATRA SAS,800180176,NO,CALLE 19 NO. 3-50 PISO 12,2826817,Privada,1
11,Bogotá D.C,11001,BOGOTÁ,1100118745,BUITRAGO & MORALES SAS,900215198,NO,CARRERA 30 No. 5-38,2770331,Privada,1
11,Bogotá D.C,11001,BOGOTÁ,1100101813,CENTRO NEUROLOGICO DE BOGOTA LIMITADA,860353671,NO,Carrera 16 No.82-95 Consultorio 606,6108069,Privada,1
11,Bogotá D.C,11001,BOGOTÁ,1100115683,BLUE LASER MEDICINA INTEGRAL S.A,900073623,NO,Calle 52 #71D - 37 Local 2,2951570 - 3144425643,Privada,1
11,Bogotá D.C,11001,BOGOTÁ,1100122399,MundoDent Clínicas Odontológicas S.A.S,900423879,,Carrera 112A No. 75B - 05,4400207,Privada,1
11,Bogotá D.C,11001,BOGOTÁ,1100119374,FORJA EMPRESAS SAS,900162688,,TV 21 No. 98 -71 OF 201,7447050 - 3002083932,Privada,1
11,Bogotá D.C,11001,BOGOTÁ,1100121217,UNIDAD DE DIAGNOSTICO ECOGRAFICO FONTIBON I P S SOCIEDAD LIMITADA SU SIGLA ES UDEF I P S LTDA,900181148,,Kra 99 N. 16 j Bis 31 segundo piso,4185063,Privada,1
11,Bogotá D.C,11001,BOGOTÁ,1100127689,CENTRO ASISTENCIAL DOMICILIARIO S.A.S - SIGLA CENAS S.A.S,900752669,,Av. Carrera 30 No 63 F - 57 OFICINA 201,3156472,Privada,1
11,Bogotá D.C,11001,BOGOTÁ,1100120680,OPERADORA DE CLINICAS Y HOSPITALES S.A.OC&H,900285393,NO,Calle 90 No. 16 - 43,7 051700 - 7 051708,Privada,1
11,Bogotá D.C,11001,BOGOTÁ,1100120061,City Ambulancias S A S,900281029,,Calle 77 No 58-23,5470631 5478148,Privada,1
11,Bogotá D.C,11001,BOGOTÁ,1100108556,FUNDACION NIÑEZ Y DESARROLLO FUNDACION FND COLOMBIA,860034503,NO,AK 60 # 63 63,3108260,Privada,1
11,Bogotá D.C,11001,BOGOTÁ,1100107680,LABORATORIO CLINICO LA CAROLINA S.A,800111969,NO,AC 127 No. 14 - 12 LCO 2,6581616,Privada,1
11,Bogotá D.C,11001,BOGOTÁ,1100117167,SALUD VISUAL EMPRESARIAL OCUPACIONAL EU,900135971,,CALLE 19 No.8-81 oficina 1005,3365407,Privada,1
11,Bogotá D.C,11001,BOGOTÁ,1100124549,CENTRO DE ACONDICIONAMIENTO Y PREPARACION FISICA WELLNESS CENTER SAS,900394968,,CALLE 69 No. 5-23,3130284-14,Privada,1
11,Bogotá D.C,11001,BOGOTÁ,1100105464,ALIRIO GUTIERREZ MILLAN Y CIA SAS UNIDAD DE ATENCIÓN PRIMARIA DARSALUD,830025766,NO,KR 78 K # 33 A 76 SUR,2657599,Privada,1
11,Bogotá D.C,11001,BOGOTÁ,1100122351,BUITRAGO & GRANDAS SAS,900204085,,CALLE 74 C SUR No. 0 -34,2 72 64 84,Privada,1
11,Bogotá D.C,11001,BOGOTÁ,1100119699,DENTAL LINE E.U.,900171194,NO,TRANV 34 A BIS # 40 67SUR,7282258,Privada,1
11,Bogotá D.C,11001,BOGOTÁ,1100128345,La dentisteria Clinica de Especialistas S.A.S,900847386,,Cra 80C#24C-19 Lc 1,5471062-3144159983,Privada,1
11,Bogotá D.C,11001,BOGOTÁ,1100123474,MEDPLUS CENTRO DE RECUPERACION INTEGRAL SAS,900496494,,Carrera 14 No 93b-15,7424943,Privada,1
11,Bogotá D.C,11001,BOGOTÁ,1100117745,UNIDAD MEDICA Y ODONTOLOGICA SANTA PILAR E.U.,900173431,NO,AVENIDA CARACAS CR 14 74 C 03 SUR,7612926,Privada,1
11,Bogotá D.C,11001,BOGOTÁ,1100100923,UNIDAD DERMATOLOGICA DE FOTOTERAPIA SAS,800207897,NO,CL 93 B # 13 92 CS 202,2566374,Privada,1
11,Bogotá D.C,11001,BOGOTÁ,1100121676,HAIR DOCTORS AND HAIR HEALTH S.A.S,900358077,,calle 108 # 17 a 68,4779152,Privada,1
11,Bogotá D.C,11001,BOGOTÁ,1100128911,UNIDAD MEDICA INTEGRAL MOTUS IPS SAS,900867338,,CL 24 A NO. 81 C 90,4975736,Privada,1
11,Bogotá D.C,11001,BOGOTÁ,1100123223,IPS BIENESTAR EN CASA SAS,900473087,,CALLE 24 No. 72 B - 53 OFICINA 202,6636159-3167449281-3185166653,Privada,1
11,Bogotá D.C,11001,BOGOTÁ,1100107318,CORVESALUD S.A.S,830007229,NO,KR 13 # 37 37 PI 8,7563900 - 3022693192,Privada,2
11,Bogotá D.C,11001,BOGOTÁ,1100121745,EVALUA SALUD IPS SAS,900380150,,CRA 45 A No. 93-56,8012047,Privada,1
11,Bogotá D.C,11001,BOGOTÁ,1100110058,MEDICOS ASOCIADOS S.A.,860066191,NO,CALLE 58 A # 37 10,3752720,Privada,6
11,Bogotá D.C,11001,BOGOTÁ,1100129667,INNOVAGENOMICS COLOMBIA SAS SIGLA INNOVAGENOMICS SAS,900800124,,Cra 45 A No. 103 86 in2,5173937,Privada,1
11,Bogotá D.C,11001,BOGOTÁ,1100107772,REVISAVIAE LTDA,800218902,NO,KR 11 # 61 19 PISO 2 OF 201 Y PISO 4 OF 401,3477371,Privada,1
11,Bogotá D.C,11001,BOGOTÁ,1100106258,UNIDAD QUIRURGICA LOS ALPES SAS,830073010,NO,KR 7 B # 127 A 14,7463713,Privada,1
11,Bogotá D.C,11001,BOGOTÁ,1100115308,CLINICA ODONTOLOGICA CLINISTETIC LTDA,830137350,NO,CALLE 58 No 17-09,3478514,Privada,2
11,Bogotá D.C,11001,BOGOTÁ,1100104768,CENTRO DE TERAPIA OCUPACIONAL LTDA,860352078,,KR 47 A # 95 67 P1,6109412-6105845-3212076449,Privada,1
11,Bogotá D.C,11001,BOGOTÁ,1100108620,CLINICA ODONTOLOGICA DEL OCCIDENTE I P S SAS,830087784,NO,AC 24 # 43 A 84,3350772,Privada,1
11,Bogotá D.C,11001,BOGOTÁ,1100106688,ORL BOSQUE LTDA,830076034,NO,AC 134 # 7 B 83 OF 719,6271711,Privada,1
11,Bogotá D.C,11001,BOGOTÁ,1100108684,ATARDECER DE LOS AÑOS LTDA,800118223,NO,KR 80 # 170 85,6711182,Privada,1
11,Bogotá D.C,11001,BOGOTÁ,1100117001,CENTRO PENSAR LIMITADA,830077128,NO,CL 142 # 18 A - 07,2581810,Privada,1
11,Bogotá D.C,11001,BOGOTÁ,1100123784,FUNDACION COLOMBIANA PARA EL DIAGNOSTICO Y TRATAMIENTO DE LAS ARRITMIAS CARDIACAS FUNDARRITMIA,900028377,,CALLE 50 N. 8 - 24 CS 301,3100450,Privada,1
11,Bogotá D.C,11001,BOGOTÁ,1100105606,LABINTOX S.A.S,800165047,NO,CL 134 No 17-71 DENTRO DE LA CLINICA MONTSERRAT,6263251,Privada,1
11,Bogotá D.C,11001,BOGOTÁ,1100126213,Guiar Salud IPS Y HSEQS EN CS,830098226,,Calle 3A Nº 53F 74,4206565,Privada,1
11,Bogotá D.C,11001,BOGOTÁ,1100131573,MED&LAB SM SAS,901054238,,CRA 54 NO 42A 73 SUR,4776989,Privada,1
11,Bogotá D.C,11001,BOGOTÁ,1100129077,Asisstanza IPS - SAS,900892703,,Carrera 16 a # 78 - 79 oficina 404,4929296 - 3144718311,Privada,1
11,Bogotá D.C,11001,BOGOTÁ,1100116090,INVERSIONES GRUPO ORAL SAS,900098622,NO,AVENIDA EL DORADO # 68 C 61 LC 132,7021244 4058592,Privada,2
11,Bogotá D.C,11001,BOGOTÁ,1100119814,FUNDACION MISION SALUD,900243760,NO,CALLE 1F N.29B-29,2011134 3004751676,Privada,1
11,Bogotá D.C,11001,BOGOTÁ,1100115731,CLINICA FERNANDO VANEGAS CANO LTDA.,900076452,NO,KR 16 No. 96 - 64 CS 314,6369541,Privada,1
11,Bogotá D.C,11001,BOGOTÁ,1100117183,LAURITA-CORPORACION PARA EL DESARROLLO INTEGRAL LTDA,900130598,NO,KR 65 No.96-31,577506664,Privada,1
11,Bogotá D.C,11001,BOGOTÁ,1100108229,CENTRO ECOGRAFICO C . G .R .,830114494,NO,CRA 15 # 33 A 21 local 102,2456047,Privada,1
11,Bogotá D.C,11001,BOGOTÁ,1100101158,PATOLAB RX LTDA,800145502,NO,KR 19C 90-14 CONSULTORIO 308-309,5226612,Privada,1
11,Bogotá D.C,11001,BOGOTÁ,1100121759,CENTRO MEDICO ARIZALUD S A S,900399004,,CR 87 F NO.59 C 15 SUR,7301282,Privada,1
11,Bogotá D.C,11001,BOGOTÁ,1100109185,CLINICA INTERNACIONAL DE CIRUGIA S.A.S,800074904,NO,KR 17 No. 39B - 04,2453075,Privada,1
11,Bogotá D.C,11001,BOGOTÁ,1100101814,CENTRO DE ENFERMEDADES MAMARIAS LTDA,800153488,NO,CRA 16 # 82 51 Cons 503 y Pisos 6 Y 7,6910851,Privada,1
11,Bogotá D.C,11001,BOGOTÁ,1100122496,MEDICAL GLOBAL CENTER SAS,900437951,,CARRERA 15 NO. 56-21,4745834,Privada,1
11,Bogotá D.C,11001,BOGOTÁ,1100120342,BOSTON MEDICAL CARE SAS IPS,900301238,,CL 127 No. 19 A - 28 CS 602 y 603,2749424 - 2749426 -3112789694,Privada,3
11,Bogotá D.C,11001,BOGOTÁ,1100117729,ZONAMEDICA MR SAS,900170994,,CALLE 40 No. 26A-50,7514626 - 3168774072,Privada,1
11,Bogotá D.C,11001,BOGOTÁ,1100106243,LABORATORIO CLINICO DE DIAGNOSTICO ANA MARIA VOLLERT LTDA,830002464,NO,AK 24 N° 86A-12,2570080/6170129,Privada,2
11,Bogotá D.C,11001,BOGOTÁ,1100121804,IPS VACUNAR COLOMBIA SAS,900394707,,CRA 18C No 26 A - 08 Sur,4082180,Privada,1
11,Bogotá D.C,11001,BOGOTÁ,1100122627,DENTIST FOR KIDS SAS,900457193,,CALLE 74 No 15-26 CS 201,2124176-2359509,Privada,1
11,Bogotá D.C,11001,BOGOTÁ,1100109221,SERVIMED INSTITUCION PRESTADORA DE SERVICIOS DE SALUD S.A. SERVIMED I.P.S. S.A.,830002272,NO,KRA 14 No 39 - 49 - Barrio:TEUSAQUILLO,2104195,Privada,8
11,Bogotá D.C,11001,BOGOTÁ,1100106016,CENTRO DE TERAPIAS OCUFILEN LTDA,830104166,NO,CALLE 117 # 6 A 83 CONS 503-504,2154844,Privada,1
11,Bogotá D.C,11001,BOGOTÁ,1100117468,OPTICAS VARGAS PEREZ LTDA,900159822,NO,CL 19 # 10 - 39,2827651,Privada,1
11,Bogotá D.C,11001,BOGOTÁ,1100113069,EXAMINAR IPS SAS,830142393,NO,CL 27 SUR # 19 - 19 Piso 1,4087000 4072406 3183832985,Privada,1
11,Bogotá D.C,11001,BOGOTÁ,1100129997,THERAPY AND TECHNOLOGY AT HOME - TTH SAS,900964062,,Cra 45 a # 101- 22 oficina 101,7551310 - 3002018334 - 3227359777,Privada,1
11,Bogotá D.C,11001,BOGOTÁ,1100117475,IMAGEN Y RADIOLOGIA ORAL SAS SIGLA IRO SAS,900108627,NO,CL 4 # 56- 04 PI 2,3049620-3107773218,Privada,1
11,Bogotá D.C,11001,BOGOTÁ,1100121400,MULTISONRISAS S.A.S,900363849,,Carrera 92 # 148 - 10,8052330- 3105561043,Privada,1
11,Bogotá D.C,11001,BOGOTÁ,1100125095,ATECHDENTAL SAS,900306631,,CRA 14 No. 93 - 40 OFICINAS 203-204,6109020 - 6114097,Privada,1
11,Bogotá D.C,11001,BOGOTÁ,1100122804,FAMILY MEDICAL ASSISTANCE SAS,900463174,,CALLE 79 60 62,3115741883 - 2612814 - 2259227,Privada,1
11,Bogotá D.C,11001,BOGOTÁ,1100127373,COTIDIANO Y FAMILIAR INSTITUCIÓN PRESTADORA EN SERVICIOS DE SALUD SAS CYF IPS SAS,900727259,,Cl 48 28 67 of 204,5482906 / 3146001282,Privada,1
11,Bogotá D.C,11001,BOGOTÁ,1100102334,RADIOLOGIA Y MEDICINA NUCLEAR DE LA SABANA SAS RADIONUCLEAR SAS,800033745,NO,AK 7 # 119 14 CONS 110,2157375,Privada,1
11,Bogotá D.C,11001,BOGOTÁ,1100105776,CENTRO MEDICO ENDOCENTRO LTDA,830043273,NO,TV 60 # 115 58 T B OF 403,6919343,Privada,1
11,Bogotá D.C,11001,BOGOTÁ,1100105748,COLFISIOS LTDA,800142589,NO,AV CL 127 # 19 A 28 CS 316,2580742,Privada,1
11,Bogotá D.C,11001,BOGOTÁ,1100123293,LABORATORIO CLINICO COLMEDICOS IPS S.A.S - COLMEDICOS S.A.S,800049104,,CARRERA 19 A 76-34,7470280,Privada,1
11,Bogotá D.C,11001,BOGOTÁ,1100122065,Complejo Internacional de Cirugia Plastica S.A.,900218008,,Calle 124 Numero 7 38/48 PI 3 Y 4,5207100 - 3163074876,Privada,1
11,Bogotá D.C,11001,BOGOTÁ,1100127414,D&G ARTE DENTAL SAS,900734364,,DIAGONAL 3 NO. 81 F 17 TERCER PISO,4010128 - 4010039,Privada,1
11,Bogotá D.C,11001,BOGOTÁ,1100133313,RED DE CLINICAS ODONTOLOGICAS NOVO SAS,901116618,,AV EL DORADO 68 C 61 OFC 730-1,3182823949- 5700312,Privada,1
11,Bogotá D.C,11001,BOGOTÁ,1100121713,keep Salud Ocupacional SAS,900358105,,carrera 27 A # 40 A - 42 Local 101 y piso 2,3103446912,Privada,1
11,Bogotá D.C,11001,BOGOTÁ,1100129009,DIALY SER S.A.S,900231793,,CALLE 44 Nº 8-31,7449484,Privada,1
11,Bogotá D.C,11001,BOGOTÁ,1100126279,ASSO LTDA ASESORIAS Y SERVICIOS EN SALUD OCUPACIONAL,800017218,,CARRERA 13 NO. 42 19 INTERIOR 2,6197780 - 213 6633 - 215 6067,Privada,1
11,Bogotá D.C,11001,BOGOTÁ,1100119179,CLINICAS ODONTOLOGICAS ESPECIALIZADAS ORTHOCLINIC LTDA,900232456,,CRA 19 A No. 162 - 51,8109849 / 8109850 / 6696178,Privada,1
11,Bogotá D.C,11001,BOGOTÁ,1100119815,SUMEDICO SAS,900255832,,Calle 127D Bis No. 70C - 70 Ofi 102,8063964-3138715322,Privada,1
11,Bogotá D.C,11001,BOGOTÁ,1100116765,LANDMARK RADIOLOGIA DENTOFACIAL LTDA.,900089131,NO,CL 53 B Nº 24 - 80 CS 714,3460568/98,Privada,1
11,Bogotá D.C,11001,BOGOTÁ,1100121761,HOSPITAL EN CASA S.A.,805006389,,Kra 28 B N° 78-41,3199555 EXT. 11160 - 11161,Privada,1
11,Bogotá D.C,11001,BOGOTÁ,1100127509,CENTRO MEDICO SAN NICOLAS M J SAS,900730623,,CALLE 103 # 70 C 15,315-3542015,Privada,1
11,Bogotá D.C,11001,BOGOTÁ,1100121201,Unidad de Fertilidad Sanitas SAS,900314131,,AV 127 N° 20 - 78 CONSULTORIO 524,5941000,Privada,1
11,Bogotá D.C,11001,BOGOTÁ,1100108930,UNIDAD DE ORIENTACION Y ASISTENCIA MATERNA-ORIENTAME,860049972,NO,CRA 18 # 33 A 27,2858004,Privada,4
11,Bogotá D.C,11001,BOGOTÁ,1100107039,CLINICA ODONTOLOGICA PROTECCION ORAL S.A.S. SIGLA COPO S.A.S.,800189531,NO,AV SUBA No. 125 - 29,6139249 - 3175161250,Privada,1
11,Bogotá D.C,11001,BOGOTÁ,1100106205,ANDREAS ROTHSTEIN S.A.S,800197749,NO,Carrera 51 n° 130-26,7458064,Privada,1
11,Bogotá D.C,11001,BOGOTÁ,1100122286,ODONTOPLUS SANTA LUCIA LTDA,900420160,,CLL 44 SUR Nª21-32,5100012,Privada,1
11,Bogotá D.C,11001,BOGOTÁ,1100110306,CARDIOPEDIATRAS LTDA,830103660,NO,KR 16 # 82 74 CS 605,6919248,Privada,1
11,Bogotá D.C,11001,BOGOTÁ,1100122816,GIGAPALMAR SOCIEDAD POR ACCIONES SIMPLIFICADA SIGLA GIGAPALMAR,900344074,,CL 121 No. 7 A 07,6290391,Privada,1
11,Bogotá D.C,11001,BOGOTÁ,1100129057,BERMEDIC LTDA,900053442,,CR 18 C NO. 121-40 OFIC 101,3112766436,Privada,1
11,Bogotá D.C,11001,BOGOTÁ,1100122818,CLINICA DE REHABILITACION INTEGRAL HÖWARD GÄRDNER S.A.S,900465827,,CALLE 75 # 27 A 47 - Barrio:ALCAZARES,6065495,Privada,2
11,Bogotá D.C,11001,BOGOTÁ,1100125014,COLINBRUS LTDA,900209693,,CL 99 N 49- 70,2362393 7550960,Privada,1
11,Bogotá D.C,11001,BOGOTÁ,1100108171,CAJA COLOMBIANA DE SUBSIDIO FAMILIAR COLSUBSIDIO,860007336,NO,CL 26 # 25-50 Piso 6 Oficina Gerencia IPS,7420100 Ext 1546,Privada,2
11,Bogotá D.C,11001,BOGOTÁ,1100116440,DENTAL SOLUTION LIMITADA,900028902,NO,CL 183 # 51-65,57 1 6795900 ext 105,Privada,2
11,Bogotá D.C,11001,BOGOTÁ,1100117190,Movilmedica de Colombia SAS,900108471,,KR 21 # 197- 77,3134141335,Privada,1
11,Bogotá D.C,11001,BOGOTÁ,1100125783,YOGASPACE IPS SAS,900589573,,KR 11 D 118 A 95 LC 101,7551313,Privada,1
11,Bogotá D.C,11001,BOGOTÁ,1100115497,SIESUA MEDICINA LASER & SPA SAS,900067141,NO,CARRERA 58 127 59 LOCAL 1100 - Barrio:NIZA,6392304,Privada,10
11,Bogotá D.C,11001,BOGOTÁ,1100132348,BioSanity Holding SAS,901058097,,AV 45 AUT NORTE 123 63,8059599,Privada,1
11,Bogotá D.C,11001,BOGOTÁ,1100108974,FUNDACION DE REHABILITACION INTEGRAL LUDUS,830090289,NO,DG 88 # 27 - 34,2561374 - 2561366 - 3165304548,Privada,1
11,Bogotá D.C,11001,BOGOTÁ,1100130262,HEALTHY KIDS S A S,900885271,,CARRERA 52 # 67 A- 71 CONSULTORIO 212,2501681 EXT 122,Privada,1
11,Bogotá D.C,11001,BOGOTÁ,1100104691,CENTRO MEDICO Y NATURISTA LOS OLIVOS SAS,800212860,NO,CALLE 63 # 13 12 PI 2,2124214,Privada,1
11,Bogotá D.C,11001,BOGOTÁ,1100111819,MARIA TERESA GALIANO SERVIMED SAS,800021891,NO,CL 50 # 8 24 CS 207 402 403 405 407 408 501,3101315,Privada,1
11,Bogotá D.C,11001,BOGOTÁ,1100132997,FUNDACION CERO A TRES DESARROLLO INFANTIL,901150745,,CR 20 Nº106 A- 80 LC 2,2133678 - 3102636286,Privada,1
11,Bogotá D.C,11001,BOGOTÁ,1100105668,HOSPITAL UNIVERSITARIO CLINICA SAN RAFAEL,860015888,NO,CRA 8 # 17 45 SUR,3282300 ext 2520,Privada,1
11,Bogotá D.C,11001,BOGOTÁ,1100123845,LAFAM SAS,900407148,,Av Cra 19 No 164-64,5205101,Privada,1
11,Bogotá D.C,11001,BOGOTÁ,1100117858,MANTILLA SILVA S.A.S.,900134936,NO,CL 87 # 15 23 OFICINA 601,571 6362351,Privada,1
11,Bogotá D.C,11001,BOGOTÁ,1100114862,UNIDAD DE FERTILIDAD FERTIVIDA SAS,900032582,NO,KR 19A No. 82-85 CONSULTORIO 401,7953130 EXT 4017,Privada,1
11,Bogotá D.C,11001,BOGOTÁ,1100118090,CLINICA CAMPO ABIERTO ORGANIZACIÓN SANITAS INTERNACIONAL LTDA,900188194,NO,KR 69 # 170 - 40,6701027,Privada,1
11,Bogotá D.C,11001,BOGOTÁ,1100121286,STELLA AMADOR TERAPIAS S.A.S.,900366609,,CR 7C No.180-43 MD 0 LC 11,6771454,Privada,1
11,Bogotá D.C,11001,BOGOTÁ,1100107768,CENTRO DE REHABILITACION PARA NIÑOS CON LABIO Y PALADAR FISURADO - FISULAB,830075397,NO,Calle 161 A N. 21-35 - Barrio:Orquideas,3146426,Privada,2
11,Bogotá D.C,11001,BOGOTÁ,1100118221,DEPIEL SAS,900126068,NO,AV CL 134 7 83 TO 3 P 5 CS 351,6270233,Privada,2
11,Bogotá D.C,11001,BOGOTÁ,1100130001,FISIOKINE IPS SAS,900952226,,carrera 64a No. 5a - 62 barrio pradera,3105508784,Privada,1
11,Bogotá D.C,11001,BOGOTÁ,1100106736,FUNDACION PARA EL NIÑO SORDO ICAL,860021072,NO,KR 7C #122-22,2135040,Privada,1
11,Bogotá D.C,11001,BOGOTÁ,1100120757,GASTROMEDICALL LTDA,900234308,,AC 127 No. 19A-44 CS 512- 513- 514-305,6250199 - 6250210/3183438113,Privada,1
11,Bogotá D.C,11001,BOGOTÁ,1100121986,SHALOM SISTEMAS ADELGAZANTES SAS,900406395,,CLL 76 No. 86-60 LC 39 - Barrio:ALAMOS,6906246,Privada,5
11,Bogotá D.C,11001,BOGOTÁ,1100117494,Fundación Colombia Nueva Vida F.C.N.V.,900141546,,Carrera 19 D No. 63-18 Sur Piso 2 (San Francisco),7183399,Privada,1
11,Bogotá D.C,11001,BOGOTÁ,1100125980,Soluciones Integrales en Salud AURUM MEDICAL SAS,900618967,,Calle 2 N° 28 06,301234 2617 3004617,Privada,1
11,Bogotá D.C,11001,BOGOTÁ,1100116467,Centro de Aprendizaje y Desarrollo San Angel SAS,900043810,NO,CARRERA 17A # 119A-38,2138421,Privada,1
11,Bogotá D.C,11001,BOGOTÁ,1100130709,FIT FOR ALL SAS,900959761,,CLL 94 N°13 -11,3103442700,Privada,1
11,Bogotá D.C,11001,BOGOTÁ,1100109526,UNIDAD DE RADIOLOGIA PANOREX PALERMO LTDA,800241455,NO,Calle 45 a # 20 - 96 consultorio 201,2671883,Privada,1
11,Bogotá D.C,11001,BOGOTÁ,1100121310,GASES INDUSTRIALES DE COLOMBIA S.A. CRYOGAS S.A,860013704,,KR 69 # 13-91,4121977,Privada,1
11,Bogotá D.C,11001,BOGOTÁ,1100120170,INVERSIONES Y SERVICIOS MANIDAN S.A,900210872,,AK 9 # 116 20 CS 205,2152852,Privada,1
11,Bogotá D.C,11001,BOGOTÁ,1100116875,SOFTCARE CLINICA ODONTOLOGICA Y MEDICA INTEGRAL LTDA,900114004,NO,KRA 47 # 94 -44,5330888,Privada,1
11,Bogotá D.C,11001,BOGOTÁ,1100106798,ASOCIACION NUCLEAR DIAGNOSTICA LTDA,800016647,NO,KR 23 # 45 C 31 CS 506 y 501,2871908 - 3105842860,Privada,1
11,Bogotá D.C,11001,BOGOTÁ,1100128212,LCA MEDICAL SAS,900822927,,CL 72 No 20 B 17 PISO 1 CS 8 PISO 2 CS 7,3103075205 - 2114212,Privada,1
11,Bogotá D.C,11001,BOGOTÁ,1100114796,NEW IMAGE AESTHETIC SURGERY LTDA,900040590,,KR 17 A # 105 - 70,6205292,Privada,1
11,Bogotá D.C,11001,BOGOTÁ,1100124366,INNOVA LASER CENTER S.A.S,900523237,,CALLE 103 N. 14A-53 CONS 504,6210236,Privada,1
11,Bogotá D.C,11001,BOGOTÁ,1100106913,CENTRO DE REHABILITACION PARA ADULTOS CIEGOS CRAC,860011298,NO,AC 8 SUR # 31 A 31,7209040,Privada,1
11,Bogotá D.C,11001,BOGOTÁ,1100106447,FUNDACION ABOOD SHAIO,860006656,NO,DIAG 115 A # 70 C 75,2261025,Privada,1
11,Bogotá D.C,11001,BOGOTÁ,1100125788,INTERNATIONAL DENTAL CENTER SAS,900587064,,AVENIDA CARRERA 58 # 129-60 LOCAL 102,3002732 / 3002733,Privada,1
11,Bogotá D.C,11001,BOGOTÁ,1100129855,ORGANIZACION MEDICO ODONTOLOGICA NACIONAL INTEGRADA S.A/SIGLA: OMNISALUD S.A,811037385,,Calle 77 Nº 20c-56,3113906006 - 3183455773 - 3115120501,Privada,1
11,Bogotá D.C,11001,BOGOTÁ,1100128783,terapias catherin tatiana jimenez sas,830514544,,CARRERA 17A # 137-58,3107658829,Privada,1
11,Bogotá D.C,11001,BOGOTÁ,1100103279,EVOLUCIONAR SERVICIOS DE SALUD SAS,830040404,NO,CL 95 No. 11-51 of. 201-204,3138542565,Privada,1
11,Bogotá D.C,11001,BOGOTÁ,1100124331,WIDEX COLOMBIA S.A.S.,800032979,,KR 7 # 119 -50 PRIMER PISO,7421652 - 3165754281,Privada,1
11,Bogotá D.C,11001,BOGOTÁ,1100108754,CENTRO DE INVESTIGACIONES DEL SISTEMA NERVIOSO LTDA- GRUPO CISNE LTDA,830100595,NO,Calle 173 A N° 65-85,3907122 - 3907123,Privada,1
11,Bogotá D.C,11001,BOGOTÁ,1100108207,FUNDACION IDEAS DIA A DIA,830118605,NO,KR 22 # 83 50,6165453,Privada,1
11,Bogotá D.C,11001,BOGOTÁ,1100117578,FOMACI EU,900160146,,CL 127 A N 7 -19 CS 608 A,3162270571,Privada,1
11,Bogotá D.C,11001,BOGOTÁ,1100129015,AG ASISTENCIAS IPS SAS,900863547,,AK 45 N° 93-39 Oficina 101,7042621,Privada,1
11,Bogotá D.C,11001,BOGOTÁ,1100106776,OTOFON SOCIEDAD POR ACCIONES SIMPLIFICADA SIGLA OTOFON S.A.S,800003111,NO,KR 7 No 119 14 CS 310-332,2153666,Privada,1
11,Bogotá D.C,11001,BOGOTÁ,1100125208,Patologia Unidad Medica Clinica del Country SAS,900338506,,Calle 167 N 72 - 07 piso 2 oficina patologia,2560457,Privada,1
11,Bogotá D.C,11001,BOGOTÁ,1100121512,CARLOS EDUARDO RANGEL GALVIS S.A.S,900352592,,CL 134 # 7 83 CS 121-122,7456047-3102799676,Privada,1
11,Bogotá D.C,11001,BOGOTÁ,1100117346,SOCIEDAD COLOMBIANA DE ODONTOLOGIA ESTETICA LTDA SIGLA SCOES LTDA,900018546,,CALLE 127 No 15-03 LOCAL 302 EDIFICIO METRO 127,6205408/3102448127,Privada,1
11,Bogotá D.C,11001,BOGOTÁ,1100116971,"PREVENCIÓN, ATENCIÓN E INVESTIGACIÓN EN SALUD LTDA, PAIS",900085600,NO,CRA 16 N° 84A-09 CS 505,6217254,Privada,1
11,Bogotá D.C,11001,BOGOTÁ,1100129297,GASTROADVANCED SAS,900656064,,CALLE 74 No.76-83 P 2,4756862,Privada,1
11,Bogotá D.C,11001,BOGOTÁ,1100109488,MEDISHI MEDICINA SEGURIDAD E HIGIENE INDUSTRIAL SAS,800025199,NO,CALLE 63 #21-19,4432320 / 3108085286,Privada,1
11,Bogotá D.C,11001,BOGOTÁ,1100127926,EMERGENCY SERVICES ASSISTANCE ESA SAS,900782672,,CARRERA 52 A No 134 D-35,5505050,Privada,1
11,Bogotá D.C,11001,BOGOTÁ,1100124732,CONSULTORIO BIOLOGICO MANDALAY SAS,900570151,,AVENIDA DE LAS AMERICAS NUMERO 78-75,4525520,Privada,1
11,Bogotá D.C,11001,BOGOTÁ,1100121519,I.P.S SER ASISTENCIA Y TRANSPORTE PARA DISCAPACITADOS SAS CON SIGLA SER SAS,900377847,,Diagonal 24 c N° 96 - 60,7425877,Privada,1
11,Bogotá D.C,11001,BOGOTÁ,1100104014,PROCREACION MEDICAMENTE ASISTIDA LTDA,830014121,NO,CALLE 50 # 7 36 PI 4 - PI 6,3481116,Privada,1
11,Bogotá D.C,11001,BOGOTÁ,1100112437,RIESGO DE FRACTURA S.A. CAYRE,830027158,NO,KR 12 # 98 38,5922999,Privada,1
11,Bogotá D.C,11001,BOGOTÁ,1100109977,SERVICIOS GRANCOLOMBIANA IPS SAS,830069567,NO,CALLE 134 # 7-83 OFICINA 245-243-244,2746397,Privada,1
11,Bogotá D.C,11001,BOGOTÁ,1100115422,Instituto Nacional para la Prevención de las Enfermedades del Riñón-PreveniRe,830122737,,CARRERA 7B Bis Numero 132-38 Consultorio 704,3102105174,Privada,1
11,Bogotá D.C,11001,BOGOTÁ,1100129374,clinica colombiana de cirugia plastica s.a.s,900551500,,AVENIDA CARRERA 45 N° 103B - 59 Piso 1,7028510 - 3103005134,Privada,1
11,Bogotá D.C,11001,BOGOTÁ,1100109271,OPTIKUS S.A.,830090640,NO,AVENIDA CARRERA 45 # 103 - 41,(571) 6020845 3008960111,Privada,1
11,Bogotá D.C,11001,BOGOTÁ,1100107889,SERVICIOS ODONTOLOGICOS GARDEAZABAL LTDA,830067260,NO,CRA 14 # 98 95 CONS 402,6107748,Privada,1
11,Bogotá D.C,11001,BOGOTÁ,1100101969,FISIOTERPIA AVANZADA S.A.S,830089444,NO,AK 45 No. 104-60 INTERIOR 2,PBX 6373133,Privada,1
11,Bogotá D.C,11001,BOGOTÁ,1100119317,CUIDARTE TU SALUD S.A.S.,900241765,NO,AVENIDA CALLE 63 # 69F-26,3847450,Privada,1
11,Bogotá D.C,11001,BOGOTÁ,1100121435,NEXUS GROUP SAS,900167158,,KR 14 A # 112 79,7427358-3204084296 - 3182817653,Privada,1
11,Bogotá D.C,11001,BOGOTÁ,1100120519,GASTROPED & DERMATOSOLUCIONES LTDA,900311921,NO,CL 90 # 19 A 49 CS 501,6017731,Privada,1
11,Bogotá D.C,11001,BOGOTÁ,1100117738,Previtest S.A IPS,900160308,NO,Calle 121 No 14B - 55,7464793 - 3046341981,Privada,1
11,Bogotá D.C,11001,BOGOTÁ,1100125093,CLINICA OFTALMÓLOGICA VISIÓN COLOMBIA SAS Y/O UNIDAD DE DIAGNOSTICO MEDICO UNIDIME SAS,900579362,,CALLE 134 NO. 7 83 TORRE 1 CONSULTORIO 1 PISO 1,3000930- 3212454161- 3204300686,Privada,1
11,Bogotá D.C,11001,BOGOTÁ,1100121567,INVERSIONISTAS Y PROTECTORES EN SALUD SAS IMPROSALUD SAS,900329703,,CRA 20 No 169-85,7443330,Privada,3
11,Bogotá D.C,11001,BOGOTÁ,1100121340,AUDIFONOS ALCIRA RAMIREZ S A S,900232301,,CL 63 No. 11 - 45 OF. 209 y 213,2550054 - 2550234,Privada,1
11,Bogotá D.C,11001,BOGOTÁ,1100115930,ESPLENDENT S A S SIGLA ESPLENDENT,830098835,NO,KR 59 A# 136 95 LC 203,2538582,Privada,1
11,Bogotá D.C,11001,BOGOTÁ,1100124885,MIMA S.A.S. sigla MIMA,900583321,,cra 7 # 32 - 16 local 325,3507851,Privada,1
11,Bogotá D.C,11001,BOGOTÁ,1100118528,COLTRAUMA SOCIEDAD POR ACCIONES SIMPLIFICADA COLTRAUMA S.A.S,900167843,NO,Calle 23 No 66-46 IN 4 CN 411,5709670,Privada,1
11,Bogotá D.C,11001,BOGOTÁ,1100105618,FUNDACION SANTA FE DE BOGOTA,860037950,NO,CL 119 # 7 75,6030303,Privada,1
11,Bogotá D.C,11001,BOGOTÁ,1100123901,GRUPO EMPRESARIAL SEVILLA SAS,900429381,,CLL 17 SUR NO 16-69,7495808,Privada,1
11,Bogotá D.C,11001,BOGOTÁ,1100102539,CENTRO OFTALMOLOGICO DE LASER LTDA - COLASER LTDA,800146271,NO,CL 93 # 15 51 OF 310 y 206-1,6185414,Privada,1
11,Bogotá D.C,11001,BOGOTÁ,1100108326,OSTRAUMA LTDA,800169802,NO,AC 127 # 21 60 CS 101,6252814,Privada,1
11,Bogotá D.C,11001,BOGOTÁ,1100132552,CASTELPA SALUD SAS,901078574,,Avenida Calle 72 # 102 04 LC 1,3183261354,Privada,1
11,Bogotá D.C,11001,BOGOTÁ,1100105659,UMED LTDA,830015894,NO,KR 21 # 26 06 SUR,2785555 - 3665291 - 3112655841,Privada,1
11,Bogotá D.C,11001,BOGOTÁ,1100119643,ULTRASONIDO VASCULAR S.A.S. CON SIGLA ULVASC S.A.S.,900254395,NO,CALLE 127 NO. 20-16 CS 509 - Barrio:LA CALLEJA,6159100 - 3174270527,Privada,3
11,Bogotá D.C,11001,BOGOTÁ,1100121264,CELAGEM SAS,900306609,,Calle 90 No 19A-49 OFICINA 902,3000024,Privada,1
11,Bogotá D.C,11001,BOGOTÁ,1100119327,INSTITUCION PRESTADORA DE SERVICIOS DE SALUD SAS SIGLA IPS SOA SAS,900228304,NO,KR 46 # 91-35,4661810 - 3132867804,Privada,1
11,Bogotá D.C,11001,BOGOTÁ,1100126288,Clinica del Pie y Spa S.A.S.,900535503,,CL 95 # 49 22,4674390 / 4674391,Privada,1
11,Bogotá D.C,11001,BOGOTÁ,1100104035,UNIDAD MEDICA Y DE DIAGNOSTICO S.A,830001007,NO,CALLE 93 N° 19 - 25,7565656 EXT 6557,Privada,3
11,Bogotá D.C,11001,BOGOTÁ,1100105725,CLINICA DE NUESTRA SEÑORA DE LA PAZ,860015905,NO,CALLE 13 # 68 F 25,2921277,Privada,1
11,Bogotá D.C,11001,BOGOTÁ,1100133267,U-FIT SAS,901133874,,CALLE 129 # 51 -38,7560107,Privada,1
11,Bogotá D.C,11001,BOGOTÁ,1100128757,DR. HELP SALUD INTEGRAL A SU HOGAR S.A.S SIGLA DR.HELP SALUDINTEGRAL S.A.S,900854445,,CL 25 C NO. 85 C 41 OF 202,3102208220 - 6495747 3112638261,Privada,1
11,Bogotá D.C,11001,BOGOTÁ,1100101287,CLINICA MEDICO OFTALMOLOGICA DEL NIÑO Y DEL ADULTO S.A.S,830049044,NO,DG 40 A BIS # 14 79,2329110 -2329103 -3202497,Privada,1
11,Bogotá D.C,11001,BOGOTÁ,1100122556,CLINICAS MEDICAS Y ODONTOLOGICAS MAGUER SAS,900451513,,CL 57 B No. 70 74 Sur,4755018,Privada,1
11,Bogotá D.C,11001,BOGOTÁ,1100119306,FUNDACION PARA EL AUTISMO Y OTROS TRANSTORNOS DEL DESARROLLO INFANTIL SEXTO SENTIDO,900164576,NO,Calle 116A No 71F 50,7024784 76024835,Privada,1
11,Bogotá D.C,11001,BOGOTÁ,1100124934,CENTRO DE COLOPROCTOLOGIA Y ENDOSCOPIA S A S,900584118,,CL 119 NO. 07 14 CN 616,2143700,Privada,1
