iddepto,nomdepto,idmpio,nompio,codigohabilitacion,nombre,nitsnit,ese,direccion,telefono,najunombre,numerosedeprincipal
11,Bogotá D.C,11001,BOGOTÁ,1100121987,CENTRO EXCELENCIA DE CUIDADOS EN SALUD ESENCIAL INSTITUCION PRESTADORA DE SERVICIOS DE SALUD S.A.S.,900348937,,CALLE 42 #13A -11,7022855,Privada,1
11,Bogotá D.C,11001,BOGOTÁ,1100104442,FUNDACION CENTRO DE PSICOLOGIA CLINICA Y DE FAMILIA ANITA,830110098,NO,KR 70 D No. 48A-78,4109944,Privada,1
11,Bogotá D.C,11001,BOGOTÁ,1100124408,SALUD HOUSE SAS,900528209,,Calle 132 47 - 08 piso 2,5204377,Privada,1
11,Bogotá D.C,11001,BOGOTÁ,1100124762,REQPERA IPS SAS,900566602,,CALLE 127 # 19A- 44 EDIFICIO ACOMEDICA II CONSULTORIO 612,4551643 3002540417,Privada,1
11,Bogotá D.C,11001,BOGOTÁ,1100112336,LABORATORIO CLINICO BIOLAB LTDA,830130006,NO,Cra 45a # 95-73,8077011,Privada,1
11,Bogotá D.C,11001,BOGOTÁ,1100102654,EMPRESA SOCIAL DEL ESTADO CENTRO DERMATOLOGICO FEDERICO LLERAS ACOSTA,800247350,SI,Avenida 1a. No. 13A - 61,912428160,Pública,1
11,Bogotá D.C,11001,BOGOTÁ,1100100733,CEUSA CENTRO DE ESPECIALISTAS EN UROLOGIA S A,800167228,NO,CARRERA 16 A No 82 - 13 OFICINA 301,6217017,Privada,5
11,Bogotá D.C,11001,BOGOTÁ,1100103323,MAGBA NEURODIGITAL S.A.S,830078811,NO,CARRERA 16A # 82-46 CONSULTORIO 711,5313807,Privada,1
11,Bogotá D.C,11001,BOGOTÁ,1100110091,TALLER PSICOMOTRIZ CRISALIDA EMPRESA UNIPERSONAL,830066670,NO,CLL 121 # 71 A 34,6433707,Privada,1
11,Bogotá D.C,11001,BOGOTÁ,1100124113,SERVICIO AEREO MEDICALIZADO Y FUNDAMENTAL SAS SIGLA MEDICALFLY SAS,900458312,,AV EL DORADO No. 103-10 ENT 1 INTERIOR 27 HANGAR 2,7958345,Privada,1
11,Bogotá D.C,11001,BOGOTÁ,1100127391,VIPAR SALUD SAS SIGLA VPS S.A.S,900626861,,AK 104 No 156-27 AP 001,3202560605-3103374118,Privada,1
11,Bogotá D.C,11001,BOGOTÁ,1100101137,MAYOR SALUD IPS LTDA,830029729,NO,KR 19 A # 116 - 19 OF 108,6378493,Privada,1
11,Bogotá D.C,11001,BOGOTÁ,1100104148,INSTITUTO VASCULAR ANDINO LTDA,830023826,NO,Av. Calle 127 N°21-60 CS 225 Sala I,2589133,Privada,1
11,Bogotá D.C,11001,BOGOTÁ,1100129891,CENTRO MEDICO VITAL DRA. ALIA SANTANA SAS,900683489,,AK 15 No. 93 60 LC 1 18,6169067,Privada,1
11,Bogotá D.C,11001,BOGOTÁ,1100120850,emermedica odontologica s.a.s,900326653,,AVENIDA CALLE 127 No 19 A -28 CS 413,6272692,Privada,1
11,Bogotá D.C,11001,BOGOTÁ,1100107851,FUNDACION DISPENSARIO SANTA FRANCISCA ROMANA,800067269,NO,calle 151 No. 16 -40,2743292,Privada,1
11,Bogotá D.C,11001,BOGOTÁ,1100117914,CORPOESCULTURA IPS E.U,900173342,NO,AV 15 # 118 41 CS 403-404-405-406-103,6127564,Privada,1
11,Bogotá D.C,11001,BOGOTÁ,1100116107,SOCIEDAD ONCOLOGICA ONCOCARE LTDA. SIGLA ONCOCARE LTDA,900078685,NO,AV KR 20 # 80 91,3207750,Privada,1
11,Bogotá D.C,11001,BOGOTÁ,1100107519,FUNDACION PARA PREVENCION Y REHABILITACION DE LA DROGADICCION Y EL ALCOHOLISMO LIBERATE,830098811,NO,TV 77 No. 166-40,6806910,Privada,1
11,Bogotá D.C,11001,BOGOTÁ,1100124918,INVERSIONES CASTAÑO TRIANA SAS,900582620,,CARRERA 112A No. 78D - 08 Piso 2,2294872,Privada,1
11,Bogotá D.C,11001,BOGOTÁ,1100132091,CENTRO DE DIAGNOSTICO EN PATOLOGIA S.A.S.,900729495,,CRA 19A NO. 85-11 CONSULTORIO 301,3132770105,Privada,1
11,Bogotá D.C,11001,BOGOTÁ,1100102344,"ASOCIACION COLOMBIANA DE PADRES CON HIJOS ESPECIALES """"ACPHES""""""",800054299,NO,Calle 186 Nº 7a-57,6788009,Privada,1
11,Bogotá D.C,11001,BOGOTÁ,1100108972,LIGA CONTRA EL CANCER SECCIONAL BOGOTA,860043211,NO,CALLE 56 # 6 28,3458346,Privada,1
11,Bogotá D.C,11001,BOGOTÁ,1100121904,CENTRO INTERNACIONAL DE MICROCIRUGÍA Y NERVIO PERIFÉRICO S.A.S.,900368196,,CL 127 A No 7-53 MODULO 2001-2002,8051976 - 3204923564,Privada,1
11,Bogotá D.C,11001,BOGOTÁ,1100128331,INVERSIONES COLMENARES SORONDO S.A.S,900744648,,CALLE 97 #23-37 CONSULTORIO 310,6100373-3107898719,Privada,1
11,Bogotá D.C,11001,BOGOTÁ,1100116430,GNQ MEDICINA ANTIENVEJECIMIENTO S A S SIGLA GNQ,900024984,NO,CL 102 # 14 A 15 PISO 3,7422244,Privada,1
11,Bogotá D.C,11001,BOGOTÁ,1100106495,ANALIZAR LABORATORIO CLINICO AUTOMATIZADO S.A.S.,891408851,,CL 103 # 14 A 76,6580000,Privada,1
11,Bogotá D.C,11001,BOGOTÁ,1100124513,SALUD OCUPACIONAL INTERNACIONAL S.A.S.,900536232,,AK 30 No 86 A 95 PISO 1,3153772767 - 7020635 - 2565853,Privada,1
11,Bogotá D.C,11001,BOGOTÁ,1100122986,GRUPO MANDARINE SAS,900439156,,CL 127 NO. 19 A 28 CS 606,8053564 - 3013717485,Privada,1
11,Bogotá D.C,11001,BOGOTÁ,1100121181,EXAMEDICA ASESORIAS INTEGRALES EN SALUD OCUPACIONAL Y MEDICINA EMPRESARIAL S EN C.S,800098835,,CRA 105 NO 22 J - 05,4155524,Privada,1
11,Bogotá D.C,11001,BOGOTÁ,1100123579,MEDIGLOBAL IPS SAS,900448559,,CLL 90 NO. 19 A 49 OFC 701,2577400,Privada,1
11,Bogotá D.C,11001,BOGOTÁ,1100119479,SANTA BARBARA SURGICAL CENTER S.A.S.,900225646,NO,KR 22 # 100 24 piso1 piso3 consultorios 1 2 3 y 7,2571399 - 2577588,Privada,1
11,Bogotá D.C,11001,BOGOTÁ,1100102351,SOCIEDAD DE ANESTESIOLOGOS DEL COUNTRY S.A.,860032625,NO,Carrera 16 82-51 CONSULTORIO 402,6183426,Privada,1
11,Bogotá D.C,11001,BOGOTÁ,1100117798,TANIA SALUD CENTRO DE VACUNACION S.A.S.,900174965,NO,kr 15 # 51 - 14 CONSULTORIO 202,2119289,Privada,1
11,Bogotá D.C,11001,BOGOTÁ,1100109104,CLINICA JUAN N CORPAS LTDA,830113849,NO,KR 111 # 159 A 61,6865000 ext 171- 3204527696,Privada,1
11,Bogotá D.C,11001,BOGOTÁ,1100128330,INNOVA ODONTOLOGIA ESPECIALIZADA SAS,900601596,,CLL 52 A NO 20-45 Piso 1 cons 102-2 piso 2 consul 3-4,2119345-5109843,Privada,1
11,Bogotá D.C,11001,BOGOTÁ,1100112425,A&G SERVICIOS DE SALUD S.A.S.,832001110,NO,AV 127 No 71-96,6240457- 3133777687,Privada,1
11,Bogotá D.C,11001,BOGOTÁ,1100129069,PROBOCARTE DENTAL GROUP SAS,900405298,,CALLE 119 N. 7-94,2141915,Privada,1
11,Bogotá D.C,11001,BOGOTÁ,1100120256,MEDICAL PROTECTION LTDA SALUD OCUPACIONAL,900170405,NO,KR 12 # 71 19,2179150-2485752,Privada,1
11,Bogotá D.C,11001,BOGOTÁ,1100133584,isangel ips sas - CLINICA EUROPA,901122726,,KR 7 # 12 B 58 CA 1 MN 1,3000712-3143873256,Privada,1
11,Bogotá D.C,11001,BOGOTÁ,1100106730,POLICLINICO SANTA FE DE BOGOTA LTDA,830115041,NO,TV 80 A # 65 J 51 SUR,7807175 - 7808920 - 3164707332,Privada,1
11,Bogotá D.C,11001,BOGOTÁ,1100117658,GRUPO DE INVERSIONES EMPRESARIALES SAS GIEM SAS,900127106,NO,AC 26 N° 68 C 61 - LCO 107,4273466,Privada,1
11,Bogotá D.C,11001,BOGOTÁ,1100117250,UNIDAD LASER Y PIEL S.A,900096842,NO,CL 134 # 7 B 83 CS 19,6049844,Privada,1
11,Bogotá D.C,11001,BOGOTÁ,1100107788,CLINICA LA SABANA S.A,800017308,NO,AV 19 # 102 53 Piso 1 y Piso 7,6221120 - 7953111,Privada,1
11,Bogotá D.C,11001,BOGOTÁ,1100129911,FISIOGESTION S.A.S,900860824,,Carrera 42 No 24 A 62 Primer piso,3187060762,Privada,1
11,Bogotá D.C,11001,BOGOTÁ,1100112848,LABORATORIO MEDICO ECHAVARRIA S.A.S,890906793,NO,KR 44 # 18 05,(1)2444888,Privada,1
11,Bogotá D.C,11001,BOGOTÁ,1100122665,GRUPO PLUSS SAS,900432033,,CALLE 19 9 01 OFICINA 805,2825621-2815175,Privada,1
11,Bogotá D.C,11001,BOGOTÁ,1100102457,SOCIEDAD DE OFTALMOLOGIA EDUARDO ARENAS ARCHILA EU,860048345,NO,CRA 21 # 100 -20 CS 701,6111711,Privada,1
11,Bogotá D.C,11001,BOGOTÁ,1100109177,CLINICA DEL SENO IPS LTDA,830117759,NO,CRA 11 # 68 36,5421044,Privada,1
11,Bogotá D.C,11001,BOGOTÁ,1100107335,CAJA DE COMPENSACION FAMILIAR COMPENSAR,860066942,NO,AV. CL 26 No. 66 A - 48,57 1 4285088,Privada,3
11,Bogotá D.C,11001,BOGOTÁ,1100108642,ACONIR ASOCIACION COLOMBIANA PRO - NIÑO RETARDADO MENTAL,800036522,NO,CALLE 153 # 106 A 88,6921552,Privada,1
11,Bogotá D.C,11001,BOGOTÁ,1100107521,CONGREGACION DE DOMINICAS DE SANTA CATALINA DE SENA,860010783,NO,CL 45F # 16A 11,3274444 ext 530-515,Privada,1
11,Bogotá D.C,11001,BOGOTÁ,1100120525,RIO SUR S A,800149580,,AC 26 # 103 08 EN 1 IN 20 A,4139857,Privada,1
11,Bogotá D.C,11001,BOGOTÁ,1100107930,ENDO MEDICA LTDA,830057319,NO,AV CR 20 N 81 54 CS 202,5302268,Privada,1
11,Bogotá D.C,11001,BOGOTÁ,1100121650,CLINICAS ODONTOLOGICAS UMPO LTDA,900326218,,Calle 18 Nº 102-39 P2,5459753,Privada,1
11,Bogotá D.C,11001,BOGOTÁ,1100119190,LABORATORIO DE REFERENCIA EN HEMOSTASIA LRH S.A.S,900197001,,KR 9 # 48 40 CS 603 - 604,2878404 - 3138843490 - 3184022487,Privada,1
11,Bogotá D.C,11001,BOGOTÁ,1100100396,CLINICA RETORNAR SAS,800160827,NO,AK 20 87 33,7957100,Privada,1
11,Bogotá D.C,11001,BOGOTÁ,1100128817,ZADA SALUD OCUPACIONAL SAS,900858795,,KR 64 # 97 63,2530712 - 3102041439,Privada,1
11,Bogotá D.C,11001,BOGOTÁ,1100120775,FUNDACION FUNCION FUTURO SANCTI SPIRITU INTELIGENCIA ESPIRITUAL IPS CAD,900324720,,KR 13 # 102 - 28 INT 1,6278006,Privada,1
11,Bogotá D.C,11001,BOGOTÁ,1100108437,SOCIEDAD MEDICA DE ORTOPEDIA Y ACCIDENTES LABORALES S A,800201496,NO,Calle 6 A # 70 - 06,7423099,Privada,1
11,Bogotá D.C,11001,BOGOTÁ,1100125770,GOOD PARTNERS & SERVICES SAS SIGLA GP & S SAS,900303221,,45 A No 95-90,7036505 7043652,Privada,1
11,Bogotá D.C,11001,BOGOTÁ,1100115272,UNIDAD MEDICA RIONEGRO LTDA,900050484,NO,CRA 22 No 83 - 51,8050082,Privada,1
11,Bogotá D.C,11001,BOGOTÁ,1100110584,CARDIOESPEC LTDA,830079513,NO,AC 127 #16 A-27 CS 204-206-213-215,6295998,Privada,1
11,Bogotá D.C,11001,BOGOTÁ,1100109143,UNION MEDICA DEL NORTE SAS,800166536,NO,CL 129 B # 92 B 09,6844466,Privada,1
11,Bogotá D.C,11001,BOGOTÁ,1100116220,FUNDACION CREER EN LO NUESTRO,900044836,NO,KR 20 # 45 A 08 OF 501,2854622,Privada,1
11,Bogotá D.C,11001,BOGOTÁ,1100103975,CENTRO MEDICO LA FACULTAD SAS,800197167,NO,CRA 18 sur No. 56A-50,7608414 - 2059235 - 3132416725,Privada,1
11,Bogotá D.C,11001,BOGOTÁ,1100120468,QUIK QUALITY IS THE KEY SAS SIGLA QUIK S.A.S,830501640,,AK 50 # 59 18,2229150,Privada,1
11,Bogotá D.C,11001,BOGOTÁ,1100128041,ESTHETIC AMP SAS,900777077,,AUT SUR # 54A-31,3004410757,Privada,1
11,Bogotá D.C,11001,BOGOTÁ,1100107564,INSTITUTO DE CIRUGIA OCULAR PALERMO LTDA,800048248,NO,CALLE 46 # 13 13,2456623,Privada,1
11,Bogotá D.C,11001,BOGOTÁ,1100110939,SAN LUIS UNIDAD DE CRONICOS Y PALIATIVOS SAS,830020398,NO,CL 127B 45 92,2583209,Privada,1
11,Bogotá D.C,11001,BOGOTÁ,1100106551,FUNDACION INSTITUTO DE REUMATOLOGIA FERNANDO CHALEM,860050632,NO,CL 73 # 20 27,3466077,Privada,1
11,Bogotá D.C,11001,BOGOTÁ,1100105742,Medicina de Rehabilitación y Electrodiagnóstico SAS,800223967,NO,CALLE 116 # 9 - 72 CONSULTORIO 712,4762774-3152741711,Privada,1
11,Bogotá D.C,11001,BOGOTÁ,1100117476,ODONTO IMAGEN Clínica Odontológica Integral Ltda,900138545,NO,CARRERA 77 A #64f-63,4887717-3162349066-3138503232,Privada,1
11,Bogotá D.C,11001,BOGOTÁ,1100116171,HABLENAUD SAS,900095652,NO,CL 8 SUR N 40 - 94,7275756,Privada,1
11,Bogotá D.C,11001,BOGOTÁ,1100123118,DIRECCION DE SANIDAD POLICIA NACIONAL,830041314,NO,CRA. 59 No. 26 21 CAN,2202146-2202600,Pública,1
11,Bogotá D.C,11001,BOGOTÁ,1100107246,CENTRO OTORRINOLARINGOLOGICO ESPECIALIZADO,830003739,NO,CRA 16 A # 84 25,5302192,Privada,1
11,Bogotá D.C,11001,BOGOTÁ,1100124430,M F SILHOUETTE S A S,900466430,,CL 171 Nº 55A-07,8050236,Privada,1
11,Bogotá D.C,11001,BOGOTÁ,1100123969,SALUD Y TECNOLOGIA SAS SAYTEC SAS,900311354,,AVENIDA CALLE 80 #100-52 SEGUNDO PISO LOCAL N2 017-018 CENTRO COMERCIAL PORTAL DE LA 80 PROPIEDAD HORIZONTAL,7498178/79/80-3175910376,Privada,1
11,Bogotá D.C,11001,BOGOTÁ,1100125946,UNIDAD DE RADIOLOGIA ORAL Y MAXILOFACIAL RADIDENT SAS,900648811,,CL 106 # 56 - 76 AP 302,6552604-3158694840,Privada,1
11,Bogotá D.C,11001,BOGOTÁ,1100101995,LABORATORIO DE OTONEUROLOGIA - INSTITUTO NACIONAL DE OTOLOGIA GARCIA GOMEZ SAS,800173625,NO,AV. 9 116 - 20 CS. 201 219 A 219 B,6122342,Privada,1
11,Bogotá D.C,11001,BOGOTÁ,1100122519,GRUPO DE ESPECIALIDADES ODONTOLOGICAS LTDA CON SIGLA ORAL QUALITY,900427623,,AV CLL 127 NO 19A-28 CONSULTORIO 211,6144271,Privada,1
11,Bogotá D.C,11001,BOGOTÁ,1100112762,SERVISALUD OCUPACIONAL IPS SAS,830136321,NO,CL 27 SUR # 14 43,3006168831,Privada,1
11,Bogotá D.C,11001,BOGOTÁ,1100105509,NEUROLOGOS CLINICOS ASOCIADOS CIA. LTDA,800243592,NO,Kr 16 No 82-74 cons 520,6919240,Privada,1
11,Bogotá D.C,11001,BOGOTÁ,1100119087,IPS YENNY ZORAYA SALAZAR M. S.A.S.,900231829,,CARRERA 35 BIS NO 58 83 INT 1,753 17 51,Privada,1
11,Bogotá D.C,11001,BOGOTÁ,1100130132,OPEN DENT SAS,900533687,,CL 90 # 14 16 OF 310-510,3017547764,Privada,1
11,Bogotá D.C,11001,BOGOTÁ,1100107807,SUPERAR LTDA,860516579,NO,CRA 19 # 63 36,2126678,Privada,1
11,Bogotá D.C,11001,BOGOTÁ,1100124369,DAVITA S.A.S.,900532504,,Cra 45A No. 103-16,6028312,Privada,1
11,Bogotá D.C,11001,BOGOTÁ,1100120036,DENTAL DIAGNOSTIC RX EL BOSQUE E.U.,900273689,NO,CL 134 No 7B 83 OF 602,5205053,Privada,1
11,Bogotá D.C,11001,BOGOTÁ,1100131514,UNIDAD SALUD ORAL S.A.S.,830069373,,KR 19 A # 82 - 85 OFICINA 818,7953131 EXT. 8181 / 3175729106 / 3212150585,Privada,1
11,Bogotá D.C,11001,BOGOTÁ,1100113483,INTEGRAL SALUD LTDA,830031646,NO,CL 109 # 17 A 35 CS 401,6021070,Privada,1
11,Bogotá D.C,11001,BOGOTÁ,1100124264,Bienestar y salud empresarial SAS,900462772,,CALLE 60 No. 15 A- 26,3043786317,Privada,1
11,Bogotá D.C,11001,BOGOTÁ,1100109316,LABORATORIO CLINICO MART SALUD S.A.S,830068715,NO,CRA 11 A No 97-37 SEGUNDO PISO,6114770,Privada,1
11,Bogotá D.C,11001,BOGOTÁ,1100108798,LABORATORIO ESPECIALIZADO SERVICONTROL LTDA,830114623,NO,CALLE 33 A # 14 30 CONS 208,5667712,Privada,1
11,Bogotá D.C,11001,BOGOTÁ,1100129712,"Centro de Medicina Avanzada Integral SAS ""CENTRO MAI IPS""",900944986,,DG 115 A 70 D 42,3006963145,Privada,1
11,Bogotá D.C,11001,BOGOTÁ,1100117696,BIOTECNOLOGIA Y GENETICA S.A. BIOTECGEN S.A.,900141569,,CALLE 119 #49-26,6372535-3153186143,Privada,1
11,Bogotá D.C,11001,BOGOTÁ,1100107037,POLICLINICO SOCIAL DEL NORTE LTDA,800177014,NO,KRA 8 H # 164 B 19,6774390,Privada,1
11,Bogotá D.C,11001,BOGOTÁ,1100102889,ANGIOGRAFIA DIGITAL S.A.S,830096175,NO,AC 134 # 7 B- 83 CS 216,5226020 - 5200004,Privada,1
11,Bogotá D.C,11001,BOGOTÁ,1100116369,ÓPTICAS GMO COLOMBIA S.A.S,900108281,,CARRERA 9 A N° 99 - 07 OF 802,(57-1)59338860 Ext. 7041,Privada,1
11,Bogotá D.C,11001,BOGOTÁ,1100126753,UNIDAD MEDICA LASER S A S,900412084,,CALLE 23 Nº 66 46 INTERIOR 4 CONSULTORIOS 1212 1218,2202700 ext 71212 71218,Privada,1
11,Bogotá D.C,11001,BOGOTÁ,1100129666,Instituto de Generacion de Tejidos SAS,900818817,,Calle 98 #9A 46 Piso 6,2560561,Privada,1
11,Bogotá D.C,11001,BOGOTÁ,1100122871,SOULMEDICAL LTDA,900064854,,"CLL 50 No. 13-62 OF 302, 701,702,703,704, y 8º piso",2485357/3138707304,Privada,1
11,Bogotá D.C,11001,BOGOTÁ,1100120152,INVERMUNDO S.A,900274280,NO,CRA 11 188 72 LC 11,5331824,Privada,1
11,Bogotá D.C,11001,BOGOTÁ,1100104870,ASONEST SAS,800151077,NO,AC 127 # 21 60 CS 218,6158788,Privada,1
11,Bogotá D.C,11001,BOGOTÁ,1100132018,GRUPO ODONTOESPECIALISTAS BACATA SAS SIGLA OMB BACATA,901013236,,CALLE 19 No. 5-30/52/62 PLANTA 1 LOCAL 5,4329093 - 3183788598,Privada,1
11,Bogotá D.C,11001,BOGOTÁ,1100121758,DENTAL BANK DE COLOMBIA SAS,900374745,,CRA 22 No 45B-38 CS 601-602,8013655,Privada,1
11,Bogotá D.C,11001,BOGOTÁ,1100125924,WESTERN DENTAL S.A.S,900550011,,CALLE 90 No. 19 A 29,5220202,Privada,1
11,Bogotá D.C,11001,BOGOTÁ,1100123765,"Centro de Evaluación Diagnóstica y Rehabilitación Neurocognitiva S.A.S., SIGLA: CEREN S.A.S.",900510844,,AV CRA 19 N° 108 - 35,3819775-4660539-3177006944,Privada,1
11,Bogotá D.C,11001,BOGOTÁ,1100112503,BIOMERTLAB LTDA,830131694,NO,AC 127 No 20-78 CONSULTORIO 416,6154711,Privada,1
11,Bogotá D.C,11001,BOGOTÁ,1100114343,INMUNOTECH LABORATORIES S.A.S.,830141394,NO,CRA 9 No 48-40 PISO 5,3143895731,Privada,2
11,Bogotá D.C,11001,BOGOTÁ,1100106024,DIAGNOSTICO & ASISTENCIA MEDICA S.A. INSTITUCION PRESTADORA DE SERVICIOS DE SALUD SIGLA DINAMICA I.P.S,800225057,NO,AK 14 No. 49-83 LC 2,3314500 ext 14572,Privada,1
11,Bogotá D.C,11001,BOGOTÁ,1100122257,Soluciones Integrales en Citologia y Patologia SAS Pudiendo Utilizar la Sigla SICPAT SAS,900428601,,Carrera 10 C No. 36 A 75 Sur,3610083,Privada,1
11,Bogotá D.C,11001,BOGOTÁ,1100128942,HEALTH & LIFE IPS SAS SIGLA H&L UCC SAS,900900122,,Avenida Carrera 30 # 12-33,2774476/ 3214595735,Privada,1
11,Bogotá D.C,11001,BOGOTÁ,1100106580,SERVICIO DE ATENCION ODONTOLOGICA LTDA SEDATO LTDA,830041565,NO,AK 68 No 68 B 05,6601318,Privada,2
11,Bogotá D.C,11001,BOGOTÁ,1100119451,CLINICA NEUROREHABILITAR LTDA,900244203,NO,CALLE 79 Nº 29C - 35,7049946,Privada,1
11,Bogotá D.C,11001,BOGOTÁ,1100118125,FUNDACION INTEGRAL SENTIR,900188967,NO,KR 70 C # 54 69,2639010,Privada,1
11,Bogotá D.C,11001,BOGOTÁ,1100116239,CENTRO VASCULAR DEL LAGO LTDA,830047504,NO,AC 116 # 9 - 72 CONSULTORIO 608,57 1 2153382,Privada,1
11,Bogotá D.C,11001,BOGOTÁ,1100127610,GRUPO EMPRESARIAL FUERZA LIDER SAS,900415872,,Carrera 69 D #2 A 20,7037078 - 3193702020,Privada,1
11,Bogotá D.C,11001,BOGOTÁ,1100112922,FUNDACION SALUD BOSQUE,830138802,NO,AC 134 # 7 B 41,6499300 - 6499329,Privada,1
11,Bogotá D.C,11001,BOGOTÁ,1100122640,ANGELA PATRICIA TORRES C SOLUCIONES EN ODONTOLOGIA S.A.S,900458252,,CARRERA 9 103 A 36 CONS 402,3163418786,Privada,1
11,Bogotá D.C,11001,BOGOTÁ,1100109184,TERAPISTAS DEL COUNTRY LTDA,800026296,NO,CRA 16 # 82 47 CONS 401,6183507,Privada,5
11,Bogotá D.C,11001,BOGOTÁ,1100129085,Conequipos Medica SAS,900364822,,Cra 27 C No 73 - 57,4673391,Privada,1
11,Bogotá D.C,11001,BOGOTÁ,1100129073,ESTETIC VIP SAS,900779417,,Calle 116 N° 17A - 30 Local 104,5237160 / 3184218031,Privada,1
11,Bogotá D.C,11001,BOGOTÁ,1100108423,Fundacion Los Pisingos,860031289,,Carrera 7 No 158 - 41,6708686,Privada,1
11,Bogotá D.C,11001,BOGOTÁ,1100116076,HORIZONTES ABA TERAPIA INTEGRAL LTDA,900053354,NO,CRA 66 A 41 A 17,7565781 3138537947 312 5009117,Privada,1
11,Bogotá D.C,11001,BOGOTÁ,1100129035,HUGO BALAGUERA CIRUGIA PLASTICA & MEDICINA ESTETICA S.A.S. - SIGLA: HUGO BALAGUERA CIRUGIA PLASTICA & MEDICINA ESTETICA S.A.S.,900741819,,CALLE 127 A Nº 7-53 CON 3001,5200360-3144610909,Privada,1
11,Bogotá D.C,11001,BOGOTÁ,1100119957,INVERSIONES MATERON ESCOBAR SAS (INMATES SAS),830121823,NO,CL 91 No 19C-62 CS 305,6105756,Privada,1
11,Bogotá D.C,11001,BOGOTÁ,1100104400,CONSULTORIO MÉDICO VICENTE DE PAUL,860048128,,CALLE 66 #27 a 26,2313025,Privada,1
11,Bogotá D.C,11001,BOGOTÁ,1100132569,ODONTOLASER COLOMBIA SAS,901136632,,AC 53 N° 21-56 LC,3165278071,Privada,1
11,Bogotá D.C,11001,BOGOTÁ,1100124610,"FUNDACION IPS DE REHABILITACION EN SALUD MENTAL CONDUCTAL Y EMOCIONAL PARA NIÑOS, NIÑAS Y ADOLESCENTES ""PSICOREHABILITAR IPS""",900217424,,KR 69 # 67A 03,2258779 - 3203991392,Privada,1
11,Bogotá D.C,11001,BOGOTÁ,1100108499,SISTEMAS INTEGRALES EN SALUD OCUPACIONAL LTDA,830072208,NO,KR 11 # 66 53 PI 4 CS 403,3045395508,Privada,1
11,Bogotá D.C,11001,BOGOTÁ,1100131716,CAPSALUD CAPACITACION Y PREVENCION EN SALUD SAS,900912287,,cra 78k #40-22 sur piso 1,3103112416,Privada,1
11,Bogotá D.C,11001,BOGOTÁ,1100116275,CIRU COUNTRY SERVICIOS MEDICOS SAS,800222501,NO,KR 10 No. 96 - 25 CS 403,6160557,Privada,1
11,Bogotá D.C,11001,BOGOTÁ,1100109208,FUNDACION SEMILLAS DE VIDA,830104502,NO,CL 35 # 21 20 - Barrio:LA SOLEDAD,3176460904,Privada,2
11,Bogotá D.C,11001,BOGOTÁ,1100128678,Centro Odontologico Oral Expert SAS,900827091,,CALLE 120 A # 7-36 OF 904 - Barrio:USAQUEN,6 19 34 31,Privada,2
11,Bogotá D.C,11001,BOGOTÁ,1100110294,Dental Image Ltda,830112975,NO,KR 13 A # 89 38 CS 705-706,6183535-8137934,Privada,1
11,Bogotá D.C,11001,BOGOTÁ,1100117536,IPS ACCION SALUD S.A.S.,900162712,NO,cra 19A No. 84-73,2569144,Privada,1
11,Bogotá D.C,11001,BOGOTÁ,1100117766,CLINICA MARCO MARTINEZ EU SIGLA CLINICA SAN MIGUEL,900174031,,CRA 7 C No. 124 - 52 primer piso,7031426 /56/62,Privada,1
11,Bogotá D.C,11001,BOGOTÁ,1100128174,14-85 DENTAL SPA S.A.S,900811857,,CARRERA 14 No.85-68 OF 303,6428828 (FIJO) - 3138306713 (CELULAR),Privada,1
11,Bogotá D.C,11001,BOGOTÁ,1100108574,AROSALUD SOCIEDAD POR ACCIONES SIMPLIFICADA AROSALUD S.A.S,830022696,NO,KR 19 A # 116 19 OF 205,6011929,Privada,1
11,Bogotá D.C,11001,BOGOTÁ,1100121050,PROFESSIONAL CARE S.A.S.,830034574,,KR 70 D # 117 63,2266418 - 6137518,Privada,1
11,Bogotá D.C,11001,BOGOTÁ,1100107164,BECERRA TORRES LIMITADA,800156646,NO,CALLE 90 # 11 44 CONS 210,6102059,Privada,1
11,Bogotá D.C,11001,BOGOTÁ,1100107313,CLINICA RANGEL PEREIRA LTDA,830028116,NO,AK 15 # 95 96,6114050,Privada,1
11,Bogotá D.C,11001,BOGOTÁ,1100116133,HOSPITAL INFANTIL UNIVERSITARIO DE SAN JOSE,900098476,NO,KR. 52 # 67 A 71,2310019,Privada,1
11,Bogotá D.C,11001,BOGOTÁ,1100117744,OPTICAS SBC LIMITADA,800102107,NO,AVENIDA CARRERA 45 No 159-50 P-2,6782077,Privada,1
11,Bogotá D.C,11001,BOGOTÁ,1100118448,IPS JAH RAFA S.A.S.,900193493,NO,CARRERA 75 # 23 A 12,6958360 4048985 6908360 4871413 6052721,Privada,1
11,Bogotá D.C,11001,BOGOTÁ,1100111076,PROSALUD SOCIEDAD POR ACCIONES SIMPLIFICADA PROSALUD SAS,860069614,NO,CRA 13 # 77 A 22,6917272,Privada,1
11,Bogotá D.C,11001,BOGOTÁ,1100121657,BIOMAB I P S SAS SIGLA BIOMAB I P S,900374337,,CALLE 48 N°13-86,7447440,Privada,1
11,Bogotá D.C,11001,BOGOTÁ,1100125070,ADMINISTRADORA CLINICA LA COLINA SAS,900582598,,CALLE 167 No 72 - 07,4897000 ext 6011 - 6010,Privada,1
11,Bogotá D.C,11001,BOGOTÁ,1100102540,INTEGRA MEDICA COLOMBIA SA,830003807,NO,CRA 14 No 127-11 CON 303 MEZANINE PISO 1,6146975,Privada,1
11,Bogotá D.C,11001,BOGOTÁ,1100102324,DIAGNOSTICO OCULAR DEL COUNTRY LTDA,830079022,NO,KR 16 # 82 95 CONS 702-506-507-508,2184979,Privada,1
11,Bogotá D.C,11001,BOGOTÁ,1100105989,CLINICA DE OJOS (CLINOJOS) S.A. / CLINOJOS S.A.,860053761,NO,"AK 45 # 95 54 1ER PISO, 2DO PISO Y 3ER PISO EN LA OFICINA 301",6237373,Privada,1
11,Bogotá D.C,11001,BOGOTÁ,1100102039,NEW SMILE CLINICA ODONTOLOGICA E.U.,830080894,NO,TRANSVERSAL 60 No. 127D-06 PISO 2,2715117 2539473,Privada,2
11,Bogotá D.C,11001,BOGOTÁ,1100101288,ORDEN MINISTROS DE LOS ENFERMOS,860013635,NO,CARRERA 15 ESTE No. 69 - 60 SUR,2072124,Privada,1
11,Bogotá D.C,11001,BOGOTÁ,1100129473,CENTRO DE ATENCION EN DIABETES Y TECNOLOGIA S.A.S CADIT SAS,900662460,,CL 83 N 16 A 44 OF 501 CS 501-8 Y 501-9,7037029-7037032- 3118947852,Privada,1
11,Bogotá D.C,11001,BOGOTÁ,1100128774,GESTION MEDICA EN SALUD SAS,900435790,,KR 14 # 119 89,2152738 3124348898,Privada,1
11,Bogotá D.C,11001,BOGOTÁ,1100105341,CENTRO COLOMBIANO DE CIRUGIA PLASTICA LTDA,830095073,NO,CL 97 # 23-37 PISO 9 CONSULTORIO 903 Y 904,6420600,Privada,1
11,Bogotá D.C,11001,BOGOTÁ,1100119231,EMPRESA DE MEDICINA INTEGRAL EMI S.A. SERVICIO DE AMBULANCIA PREPAGADA SIGLA GRUPO EMI S.A.,811007601,,KR 68 D # 18 30,3077364-3105362359,Privada,1
11,Bogotá D.C,11001,BOGOTÁ,1100121477,UNIDAD MEDICA ONCOLOGICA ONCOLIFE IPS SAS,900364721,,CALLE 45C No. 25-40,3108095504 -2459595-2454888,Privada,1
11,Bogotá D.C,11001,BOGOTÁ,1100127957,OAK BUSINESS SAS,900770767,,Diagonal 71 B # 98 04 Piso 1 y Mezanine,7030103 - 3002667624,Privada,1
11,Bogotá D.C,11001,BOGOTÁ,1100122082,IPS DE LAS AMERICAS SAS,900413988,,AK 10 N°16-29 SUR,7427846,Privada,1
11,Bogotá D.C,11001,BOGOTÁ,1100108222,EUSALUD S.A,800227072,NO,DG 54 # 16 A 16,4320872,Privada,1
11,Bogotá D.C,11001,BOGOTÁ,1100103107,OPTICA APOLO S A S,830051898,NO,AK 58 # 127 59 LC 1-57,2263748,Privada,1
11,Bogotá D.C,11001,BOGOTÁ,1100103998,FUNDACION DEL QUEMADO,830003252,NO,CL 128 B # 59 B 20,6433318,Privada,1
11,Bogotá D.C,11001,BOGOTÁ,1100115879,ODONTOLOGOS COLOMBIANOS ESPECIALIZADOSLTDA,900070486,NO,CARRERA 58 No 137B-38 piso 3,2 71 62 26,Privada,1
11,Bogotá D.C,11001,BOGOTÁ,1100112413,MD DIAGNOSTICOS SAS,830128120,NO,AK 20 # 85 A - 45 CONS 101 - 102 - 103 - 104 - 105 - 106 - 108 - 109,2123360,Privada,5
11,Bogotá D.C,11001,BOGOTÁ,1100113784,NEUROCOUNTRY LTDA,830145701,,CARRERA 16A No. 82-46 PISO 1,7043483,Privada,1
11,Bogotá D.C,11001,BOGOTÁ,1100125794,SKIN TEAM S.A.S,900638355,,AC134 7B 83 OF 122 CS 5,6260751,Privada,1
11,Bogotá D.C,11001,BOGOTÁ,1100127771,PROGRAMAS DE MEDICINA LABORAL IPS SAS,900556564,,CARRERA 24 N° 36 - 08,6057514 - 3132781309,Privada,1
11,Bogotá D.C,11001,BOGOTÁ,1100105620,TERAPIAS SAS,830056902,NO,CL 135A # 10B -13,6253976,Privada,1
11,Bogotá D.C,11001,BOGOTÁ,1100130194,INFU-ENFERMERIA SAS,900974143,,CALLE 23 # 66 - 46 INT 4 CS 903,5716903 /3202361494,Privada,1
11,Bogotá D.C,11001,BOGOTÁ,1100108403,RED ORAL LTDA,830057559,NO,CRA 82 # 23C- 24,2734079,Privada,1
11,Bogotá D.C,11001,BOGOTÁ,1100116016,Fundacion la Casa de Bill,830147172,,KR 36A Nº 54 - 77,6940460,Privada,1
11,Bogotá D.C,11001,BOGOTÁ,1100128081,IPS PROACTIVA ENFASIS EN PATOLOGIAS CRONICAS SAS,900763869,,CALLE 28 # 13 A 24 OFICINA 511,3003244067,Privada,1
11,Bogotá D.C,11001,BOGOTÁ,1100123884,SALUD DOMICILIARIA P&M.SAS,900514854,,CARRERA 81 D # 25 C 49,5472803,Privada,1
11,Bogotá D.C,11001,BOGOTÁ,1100127497,UROLOGIA DE COLOMBIA SAS,900722692,,AK 9 # 103 A 36 CONSULTORIO 304 - 6,6290009 - 3007192019,Privada,1
11,Bogotá D.C,11001,BOGOTÁ,1100105165,INSTITUTO DE GASTROENTEROLOGIA LTDA,860350678,NO,CALLE 93 B # 13 92 OF 201,6235500,Privada,1
11,Bogotá D.C,11001,BOGOTÁ,1100128491,SALUD LINEA VITAL IPS SAS,900713957,,Calle 123 N 7- 60 PISO 6,6296220-3044817438,Privada,1
11,Bogotá D.C,11001,BOGOTÁ,1100100356,BIONUCLEAR S.A.S,800224466,NO,"AK 45 # 106 30 OFICINA 204, CONSULTORIO 201 Y 209",6207838 - 7521203,Privada,1
11,Bogotá D.C,11001,BOGOTÁ,1100130045,ESTEBAN Y AGUIRRE SAS,900968348,,CALLE 45 A SUR No 54B - 45,3099783,Privada,1
11,Bogotá D.C,11001,BOGOTÁ,1100105944,CLINICA DE ESPECIALISTAS LINEA ORAL LTDA,830101745,NO,CALLE 12 SUR # 31 33 PI 1,7204077,Privada,1
11,Bogotá D.C,11001,BOGOTÁ,1100115117,CENTRO MEDICO DEPORTIVO MET LTDA,830114167,,AK 45 NO 101-17 PISO 1,6349200-2368230,Privada,1
11,Bogotá D.C,11001,BOGOTÁ,1100131898,SANTE MEDICAL CENTER SAS,901048303,,KR 49 # 94 - 80,3006763889,Privada,1
11,Bogotá D.C,11001,BOGOTÁ,1100107161,OPTICA ALEMANA SCHMIDT HIJOS LTDA,860000812,NO,CARRERA 15 N 84-72 - Barrio:ANTIGUO COUNTRY,7043379-7043380,Privada,3
11,Bogotá D.C,11001,BOGOTÁ,1100127905,DENTIX COLOMBIA SAS,900759454,,CARRERA 19 NO 90 - 10 PISO 4,7481555,Privada,1
11,Bogotá D.C,11001,BOGOTÁ,1100118976,IPS FERNANDO KUAN MEDINA SAS,900147276,,CL 70 N0 29-16 PISO 1,5405182-5403190- 3104622799-3105294491,Privada,1
11,Bogotá D.C,11001,BOGOTÁ,1100100731,PREMISALUD S.A.,830088332,NO,AV 1 DE MAYO 68 I-12/18,2730475,Privada,3
