iddepto,nomdepto,idmpio,nompio,codigohabilitacion,nombre,nitsnit,ese,direccion,telefono,najunombre,numerosedeprincipal
11,Bogotá D.C,11001,BOGOTÁ,1100101624,MEDICANESTESIA S.A,860350624,NO,Avenida 9 # 116 20 CS 722 - 728 - 740,6122362,Privada,1
11,Bogotá D.C,11001,BOGOTÁ,1100129579,SERVITRAUMAX SAS,900439194,,AC 116 # 16 45 PISO 1,6128135-3508264768,Privada,1
11,Bogotá D.C,11001,BOGOTÁ,1100110816,JGC MEDISERVICIOS LTDA,800222326,NO,CARRERA 52 NO 67 A - 71 CONSULTORIO 212,6233368,Privada,1
11,Bogotá D.C,11001,BOGOTÁ,1100115718,ASSISTANCE INTERNATIONAL,830118309,NO,KR 46 # 126-33,6205647,Privada,1
11,Bogotá D.C,11001,BOGOTÁ,1100118233,CLINICA ORTHOESPECIALISTAS SAS,900194986,,Kr 16 #96-64 CS 307,57(1)6369521,Privada,1
11,Bogotá D.C,11001,BOGOTÁ,1100101197,CENTRO MAMOGRAFICO S A S,860530669,NO,CRA 16 # 84 A 09 CONS 421 422,6217294,Privada,1
11,Bogotá D.C,11001,BOGOTÁ,1100130294,SUBRED INTEGRADA DE SERVICIOS DE SALUD SUR E.S.E.,900958564,SI,Carrera 20 No. 47 B 35 Sur,4853551 - 4853715,Pública,1
11,Bogotá D.C,11001,BOGOTÁ,1100130285,SOCIEDAD OFTALMOLOGICA MFJ IPS S.A.S,900065662,,CRA 7 No. 72 64 CS 219,2556302,Privada,1
11,Bogotá D.C,11001,BOGOTÁ,1100114524,KALIL & CABALLERO ODONTOLOGOS SAS,830510791,,CARRERA 23 # 124 - 70 COS 602,6371909-6298497,Privada,1
11,Bogotá D.C,11001,BOGOTÁ,1100122052,CLINICA DENTAL NETWORK S.A.S,900265316,,Calle 103 NO.14a-10,6210533,Privada,1
11,Bogotá D.C,11001,BOGOTÁ,1100128023,ASMED SALUD SAS,900767027,,DIAGONAL 5 A # 73- 05,3173816515,Privada,1
11,Bogotá D.C,11001,BOGOTÁ,1100111622,CARDILOGICAS LTDA,800113386,NO,CL 45F # 16 A 11,3400439,Privada,1
11,Bogotá D.C,11001,BOGOTÁ,1100121827,RehaSer S.A.S,900405007,,Carrera 20# 125 - 38 CONSULTORIOS 105 Y 106,2159912 3118803493,Privada,1
11,Bogotá D.C,11001,BOGOTÁ,1100127682,GLOBAL HEALTH CARE SAS SIGLA GHC SAS,900537136,,AV BOYACA No. 64 F 92,4929949,Privada,1
11,Bogotá D.C,11001,BOGOTÁ,1100125223,Constanza Gonzalez Sanchez SAS,900448997,,Av de las Americas No. 69-60,2604278 - 3153899348,Privada,1
11,Bogotá D.C,11001,BOGOTÁ,1100108575,IPS CLINICA JOSE A RIVAS S.A.,800149169,NO,AK 19 N 100-28 - Barrio:CHICO,6163077,Privada,2
11,Bogotá D.C,11001,BOGOTÁ,1100114735,Fundación para el Servicio Integral de Atención Médica - Fundación SIAM,900034438,,CL 58 A # 35 A 12,2219283,Privada,2
11,Bogotá D.C,11001,BOGOTÁ,1100103270,SERVICIO DE INMUNOANALISIS DE BOGOTA LTDA-SIB LAB LTDA,800123007,NO,CALLE 50 # 8 24 CONS 306 307,3100186,Privada,1
11,Bogotá D.C,11001,BOGOTÁ,1100124548,"CENTRO DE ESTIMULACION, REHABILITACION Y APRENDIZAJE SEMILLAS DE ESPERANZA S.A.S SIGLA: CERASES S.A.S",900550197,,CL 143 B # 143 A 14 Y 18,3175156113,Privada,1
11,Bogotá D.C,11001,BOGOTÁ,1100125827,SOCIEDAD DE DIAGNOSTICO VISUAL SAS,900602873,,AK 9 # 116 - 20 AP 502,2142130,Privada,1
11,Bogotá D.C,11001,BOGOTÁ,1100130903,GRUPO JOKMAC S.A.S,900498809,,Carrera 15A #122-42,4824474,Privada,1
11,Bogotá D.C,11001,BOGOTÁ,1100129087,SOCIEDAD ESTETIC DENT SAS,900878184,,CR 27 No 4A-13/15,3705713 - 3125381444,Privada,1
11,Bogotá D.C,11001,BOGOTÁ,1100117508,INVERSIONES TRIVAL S.A.S,830093422,NO,CALLE 100 No 23-44 cons 102,6241944-3102800896,Privada,1
11,Bogotá D.C,11001,BOGOTÁ,1100101600,CARDIOLOG LABORATORIO DE CARDIOLOGIA INTEGRAL LIMITADA,800167356,,AC 127 # 20 78 CS 409 y 411,2593531-6156908,Privada,1
11,Bogotá D.C,11001,BOGOTÁ,1100104261,INSTITUTO DE ESTUDIOS CIENTIFICOS EN ODONTOLOGIA S.A SIGLA IECO,830017652,NO,CL 150 NO. 16- 56 CONS 3-006 3-010 Y 1-139,6146447,Privada,1
11,Bogotá D.C,11001,BOGOTÁ,1100125275,Emmanuel Instituto de Rehabilitacion y Habilitacion Infantil s.as,900259421,,Calle 17 #69b-06 - Barrio:Zona industrial,7433693-3007277428-3022874789,Privada,2
11,Bogotá D.C,11001,BOGOTÁ,1100122979,RED VIDA SAS,900450748,,Calle 127 Numero 71 - 20,7003973,Privada,1
11,Bogotá D.C,11001,BOGOTÁ,1100101582,LABORATORIO VASCULAR ECOLAB Y COMPAÑIA LIMITADA,830017706,NO,KR 18 # 84 11 CS 603,6100818,Privada,1
11,Bogotá D.C,11001,BOGOTÁ,1100100930,"FUNDACION CENTRO DE INVESTIGACION E INFORMACION EN DEFICIENCIAS AUDITIVAS-""""CINDA""""""",800223876,NO,CALLE 35 No. 17-24,5104341- 5106499- 5103829,Privada,1
11,Bogotá D.C,11001,BOGOTÁ,1100121241,AYUDA MEDICA TERRITORIAL EN AMBULANCIAS AYMEDT AMBULANCIAS LTDA SIGLA AYMEDT AMBULANCIAS LTDA,900268094,,KR 4 # 28-07 SUR Piso2,5990689 - 3626503,Privada,1
11,Bogotá D.C,11001,BOGOTÁ,1100129495,SOCIEDAD DE SERVICIOS INTEGRALES EN SALUD SAS.- SIGLA: SERVINSALUD IPS,900534245,,KRA 72A N 8 O6 LOCAL 7,3114560450,Privada,1
11,Bogotá D.C,11001,BOGOTÁ,1100115528,CIUDAD SALUD COLOMBIA IPS SOCIEDAD POR ACCIONES SIMPLIFICADA. SIGLA CIUDAD SALUD COLOMBIA IPS S.A.S,830114141,NO,Diagonal 17 B No 90 - 64 Bodega 4,4127319 - 4246548,Privada,1
11,Bogotá D.C,11001,BOGOTÁ,1100127547,Emotion Fit Center SAS,900748069,,ak 58 # 131 a - 06,3124344215,Privada,1
11,Bogotá D.C,11001,BOGOTÁ,1100115707,DENTOLASER S.A.S.,830140988,NO,KR 21 # 56 03,3126688,Privada,1
11,Bogotá D.C,11001,BOGOTÁ,1100127534,FUNDACION SAMAI PAZ Y ESPERANZA,900519775,,KR 107 A # 16 I - 39,4131787-3204842574-3014440596-,Privada,1
11,Bogotá D.C,11001,BOGOTÁ,1100131632,UNIDAD CLÍNICA DEL SISTEMA NERVIOSO LIMITADA - RENOVAR LTDA,822001338,,CL 7 SUR # 7A - 63,8053361,Privada,1
11,Bogotá D.C,11001,BOGOTÁ,1100107876,UNIFISIO LTDA,860078062,NO,CRA 23 # 45C-31 CONS 609 / 610,2875525,Privada,1
11,Bogotá D.C,11001,BOGOTÁ,1100115867,PATOLOGIA DIAGNOSTICA LIMITADA,900081381,,AK 19 A # 116 19 (TV 26 # 116 19) CS 106,2147750,Privada,1
11,Bogotá D.C,11001,BOGOTÁ,1100109666,CLINICA DEL OCCIDENTE S.A.,860090566,NO,AV DE LAS AMERICAS # 71 C 29,4254620 Ext 671,Privada,1
11,Bogotá D.C,11001,BOGOTÁ,1100133344,CORPORAL FITNESS SAS,900970733,,CRA 71 NO 127-11,3013710913,Privada,1
11,Bogotá D.C,11001,BOGOTÁ,1100115099,LINDE COLOMBIA S.A,860005114,NO,AK 14 No. 40A-04,5556939,Privada,2
11,Bogotá D.C,11001,BOGOTÁ,1100122788,CLINICA ODONTO LIFE SAS,900452703,,Cra 77 A N° 64 G- 04 piso 2,4308632,Privada,1
11,Bogotá D.C,11001,BOGOTÁ,1100107411,LABORATORIO CLINICO DE MARLY DANIEL GAMBOA & CIA LTDA,800009646,NO,CALLE 50 # 9 67 INT 101,2454906,Privada,1
11,Bogotá D.C,11001,BOGOTÁ,1100130640,INVERSIONES SANCHEZ & SALCEDO S.A.S,900557256,,CL 42 N° 66 - 42 PISO 1,3456755,Privada,1
11,Bogotá D.C,11001,BOGOTÁ,1100117954,EVOLUTION DENTAL CENTER E.U,900178799,NO,CLL 119 #11D - 18 PRIMER PISO CONSULTORIOS 1 2 3 4 SEGUNDO PISO CONSULTORIO 5,2144987,Privada,1
11,Bogotá D.C,11001,BOGOTÁ,1100119440,GRUPO CIMCO SAS.,900234969,NO,CL 45 N° 27 A 12,3680068,Privada,2
11,Bogotá D.C,11001,BOGOTÁ,1100129079,SEDOANESTESIA - ANESTESIA ESPECIALIZADA EN SEDACIÓN SAS - SIGLA SEDOANESTESIA SAS,900828854,,KR 17A Nº 119A-09 CS 109 A,5237397- 3156040165 - 3212149082,Privada,1
11,Bogotá D.C,11001,BOGOTÁ,1100118539,CLÍNICA VASCULAR DE COLOMBIA-JORGE NAVARRO-MD S.A.S,900192709,NO,CARRERA 14 # 127-11 CONS 407,6581604,Privada,1
11,Bogotá D.C,11001,BOGOTÁ,1100106971,FUNDACION ARTHUR STANLEY GILLOW,860016372,NO,AV. CALLE 100 # 11 B 04,6200937,Privada,1
11,Bogotá D.C,11001,BOGOTÁ,1100128104,CLINICAS ODONTOLOGICAS SHEKINAH SAS SIGLA ODONTO SHEKINAH SAS,900781377,,CR 19A # 82 85 CONSULTORIO 220,6180233 - 3209490262,Privada,1
11,Bogotá D.C,11001,BOGOTÁ,1100122385,ECLAT MEDICINA ESTETICA Y ANTIENVEJECIMIENTO SAS,900440912,,CARRERA 17 N. 106 - 16 CONSULTORIO 202 - 205,3132621954,Privada,1
11,Bogotá D.C,11001,BOGOTÁ,1100103543,FOTOTERAPIA BOJANINI Y LOPEZ SAS,800236964,NO,CL 125 # 19 89 OFIC 404,6372151,Privada,1
11,Bogotá D.C,11001,BOGOTÁ,1100122470,aerosanidad sas,900236791,,Avenida eldorado no.113-90,2205674-3002221245,Privada,1
11,Bogotá D.C,11001,BOGOTÁ,1100125441,CLINICA SAN FRANCISCO DE ASIS SAS,900613550,,CALLE 16 16-80,5190707 ext 126,Privada,1
11,Bogotá D.C,11001,BOGOTÁ,1100108120,GARCIA PEREZ MEDICA Y COMPAÑIA SAS,800231038,NO,CL 45 C # 22 02 PI 2,"3381215,3381216,2871949",Privada,1
11,Bogotá D.C,11001,BOGOTÁ,1100133457,SDO SALUD SOLUCIONES DIAGNOSTICAS SAS,901169356,,Calle 97 23-37 consultorio 707,3014511364,Privada,1
11,Bogotá D.C,11001,BOGOTÁ,1100124096,GRUPO LABORAL OCUPACIONAL SAS,900451870,,KR 61 # 100-56 PISO 1,7512005 - 3164472404,Privada,1
11,Bogotá D.C,11001,BOGOTÁ,1100120057,SERVICIOS MEDICOS VITAL HEALTH S.A.S,900282039,NO,CALLE 30 No 17 70,7447462,Privada,1
11,Bogotá D.C,11001,BOGOTÁ,1100118234,PROGRAMA MADRE CANGURO INTEGRAL LTDA,900196201,NO,CALLE 44B No. 53-50,7458182,Privada,1
11,Bogotá D.C,11001,BOGOTÁ,1100129372,Compañía Medica y Anestésica SAS,900899492,,Cra 20 No. 40-39 Ofc 202,2850656,Privada,1
11,Bogotá D.C,11001,BOGOTÁ,1100130345,SALUD Y ATENCION A PERSONAS ADULTAS SAS SIGLA PERSADULT HOME SAS,900976655,,CALLE 65 No 7 49 OF 101,3480919 - 3165567763 - 3158231224,Privada,1
11,Bogotá D.C,11001,BOGOTÁ,1100121020,REHABILITARTE PLUS SAS,900345805,,AV. SUBA Nº 106- A 28 CONSULTORIO 601,6139952 - 3212484879,Privada,1
11,Bogotá D.C,11001,BOGOTÁ,1100119079,ORGANIZACION PRAGMA DE COLOMBIA S.A,900211766,,CALLE 122 Nº 23-28 PISO 1,7561298,Privada,1
11,Bogotá D.C,11001,BOGOTÁ,1100132253,CENTRO INFANTIL PARA EL NEURODESARROLLO EN FAMILIA SAS - CINEFA,901082946,,"Carrera 7b bis # 132-38, Edificio Forest Medical Center Consultorio 605",7441827 - 3163794331,Privada,1
11,Bogotá D.C,11001,BOGOTÁ,1100121876,CENTRO INTERNACIONAL INTEGRAL DE RESTAURACION - CIIR,830094001,,Carrera 27 A No. 4 A - 41,5996537,Privada,1
11,Bogotá D.C,11001,BOGOTÁ,1100120598,Profesionales en Servicios Integrales de Salud SAS,900312960,NO,CRA 9 N° 53 - 58 OFICINA 311,3213303736,Privada,1
11,Bogotá D.C,11001,BOGOTÁ,1100124093,FISIOS CENTRO DE TERAPIA SAS,900419172,,AK 45 # 106 25 OF 102 301 401,3046037530,Privada,1
11,Bogotá D.C,11001,BOGOTÁ,1100107968,FUNDACION FE,860029566,NO,CRA 59 b No. 129 - 45,6240507,Privada,1
11,Bogotá D.C,11001,BOGOTÁ,1100109098,FUNDACION PARA EL DESARROLLO DE LAS CIENCIAS DE LA COMUNICACIÓN SOCIAL FUNDEMOS,860050914,NO,CARRERA 16 A 79 - 94,546 06 40,Privada,1
11,Bogotá D.C,11001,BOGOTÁ,1100102317,IMEVI SAS,830027558,NO,TRV. 60 No. 115 - 27/37,7462749,Privada,5
11,Bogotá D.C,11001,BOGOTÁ,1100128195,FUNDACION SARON,900375374,,CL 7A No. 71 B 23,2602527-4738789,Privada,1
11,Bogotá D.C,11001,BOGOTÁ,1100129470,HSEQ UNIDAD MEDICA LABOR VITAL SAS,900891785,,CR 103 A N° 17 A 44,2983537 - 3114657196,Privada,1
11,Bogotá D.C,11001,BOGOTÁ,1100110909,DDS LTDA CLINICA DE REHABILITACION DENTAL,830093411,,CL 97 A # 8 41,6104900,Privada,1
11,Bogotá D.C,11001,BOGOTÁ,1100122807,VITALEM IPS SAS,900462440,,CRA 23 137 57,4788401,Privada,1
11,Bogotá D.C,11001,BOGOTÁ,1100103863,OPTICA ALEMANA EYH SCHMIDT SA,860008392,NO,AC 19 # 9 47,2432917,Privada,1
11,Bogotá D.C,11001,BOGOTÁ,1100121212,FUNDACION FENIMA,900353938,,CL 7a No. 71b - 75,2234297 - 2612465 - 3204861770,Privada,1
11,Bogotá D.C,11001,BOGOTÁ,1100119603,ORGANIZACION VIHONCO IPS S.A.S.,900098985,NO,AV CALLE 127 #71 B 72,7464438,Privada,1
11,Bogotá D.C,11001,BOGOTÁ,1100126268,RPA SALUD OCUPACIONAL LTDA,900638732,,KR 16 A # 75 65,3002725 3204386785,Privada,1
11,Bogotá D.C,11001,BOGOTÁ,1100115235,ODONTOLOGIA ESPECIALIZADA COLOMBIANA CLINICAS DENTALES S.A.,900020963,NO,CL 108 14B 24,57 091 2154848,Privada,1
11,Bogotá D.C,11001,BOGOTÁ,1100109831,SOMNARUM S.A.S,830001004,NO,CRA 19 # 84 - 17 CONSULTORIO 302,6366514/6366515,Privada,1
11,Bogotá D.C,11001,BOGOTÁ,1100118933,E F FRESNEDA ODONTOLOGIA ESPECIALIZADA LTDA,900223876,NO,CL 20 SUR 18 04,2094996,Privada,1
11,Bogotá D.C,11001,BOGOTÁ,1100118635,ESTACION DENTAL S.A.S.,900188667,NO,KR 47 A #114-19,6129930,Privada,1
11,Bogotá D.C,11001,BOGOTÁ,1100129416,BIOSHAPE H&AE S.A.S,900882889,,CRA 17 A Nº 119 A - 90 LOCAL 101 PISO 1,3003676048,Privada,1
11,Bogotá D.C,11001,BOGOTÁ,1100101443,OFTALMOS S.A.,860006626,NO,AV 100 No. 18 A 51,2563285,Privada,1
11,Bogotá D.C,11001,BOGOTÁ,1100117389,CLINISUR IPS 1 LTDA,900148264,,Calle 27 Sur No 19-07,2784705,Privada,1
11,Bogotá D.C,11001,BOGOTÁ,1100126917,Colcuidar Sociedad por acciones simplificada es decir COLCUIDAR SAS,900440926,,Calle 22 B#66-46 cons.504,3 15 59 17 / 313 8 35 78 45,Privada,1
11,Bogotá D.C,11001,BOGOTÁ,1100103542,CENTRO INTEGRAL DE ATENCION EN SALUD MENTAL LTDA,800091030,,KR 49 N.102 A 06,2563890,Privada,1
11,Bogotá D.C,11001,BOGOTÁ,1100103071,CENTRO MEDICO DE ORIENTACION LA GLORIA S.A.S SIGLA IPS LA GLORIA S.A.S,830062334,NO,CALLE 34 # 15 51,3402120,Privada,1
11,Bogotá D.C,11001,BOGOTÁ,1100120538,AVENIR CIA LTDA,830062617,NO,Cl 50 Nº 8-24 CS 305,571-3498510,Privada,1
11,Bogotá D.C,11001,BOGOTÁ,1100133350,TODO EN SALUD IPS SAS,901176438,,KR 89A # 82 09 PI 1,3124692716,Privada,1
11,Bogotá D.C,11001,BOGOTÁ,1100121780,FUNDACION SAINT,900389726,,AK 45 No. 114-10 Sala 1,6028311,Privada,1
11,Bogotá D.C,11001,BOGOTÁ,1100122577,CENTRO OFTALMOLOGICO GAVAVISION EU,900106018,,AV CARACAS CARRERA 14 NO. 38-34,3102188167,Privada,1
11,Bogotá D.C,11001,BOGOTÁ,1100119152,GELAWEL SOCIEDAD ANONIMA,900109291,,CL 119 No. 12 25 piso 1,6193820,Privada,1
11,Bogotá D.C,11001,BOGOTÁ,1100126688,CENTRO MEDICO CURARE SAS,900661728,,Calle 23 N°4A- 36,2837334,Privada,1
11,Bogotá D.C,11001,BOGOTÁ,1100121172,SERVICIOS MEDICOS M S LTDA,860353462,,CALLE 50 N° 8-27 OFICINA 204,2326120 - 3436600 EXT 1529,Privada,1
11,Bogotá D.C,11001,BOGOTÁ,1100122219,MAXIDENT CEDRITOS CLINICAS ODONTOLÓGICAS SAS,900429728,,Cra.19D No 63-14 Sur P 2,7 170102,Privada,1
11,Bogotá D.C,11001,BOGOTÁ,1100105715,CENTRO DE PSICOLOGIA Y APRENDIZAJE INTEGRAL CEMPAI LTDA,830012332,NO,CALLE 144 No. 23 - 06,5204786 - 3108176600,Privada,1
11,Bogotá D.C,11001,BOGOTÁ,1100100732,OPTICA DR MENDEZ S A S,860513677,NO,CRA 13 # 42 08,2859753,Privada,1
11,Bogotá D.C,11001,BOGOTÁ,1100123371,inversiones sequoia colombia S.A.S,900485519,,calle97#23-10,7442740-7452727,Privada,1
11,Bogotá D.C,11001,BOGOTÁ,1100117255,CIFEL CENTRO DE INVESTIGACION EN FISIATRIA Y ELECTRODIAGNOSTICO S.A.S. Sigla: CIFEL S.A.S,900129308,NO,AV AMERICAS # 59-29,3175759331-3005627130,Privada,1
11,Bogotá D.C,11001,BOGOTÁ,1100116450,TPF CIRUJANOS Y CIA LTDA- NUEVA CLINICA LOS CEDROS,900090619,NO,CL 137 # 19 42,7433956,Privada,1
11,Bogotá D.C,11001,BOGOTÁ,1100103106,CENTRO DE ANALISIS MOLECULAR S.A,830048477,NO,AK 45 No. 150-10,6153629,Privada,1
11,Bogotá D.C,11001,BOGOTÁ,1100107567,CENTRO OFTALMOLOGICO OLSABE S.A.S,800169433,NO,CALLE 120 # 7 38,6191669,Privada,1
11,Bogotá D.C,11001,BOGOTÁ,1100101010,INVERSIONES EN RECREACION DEPORTE Y SALUD S.A Y PODRA TAMBIEN DESIGNARSE CON LA SIGLA BODYTECH,830033206,NO,carrera 19 B # 83-11,7442222- EXT 40257 CELULAR 3204885617,Privada,1
11,Bogotá D.C,11001,BOGOTÁ,1100127099,Art Medica S.A.S,900298928,,trasversal 27a # 53b -96 Piso 1 Consultorio 1 sala de procedimientos menores Piso 2 Consultorio 2 Consultorio 3 Consultorio 4 Consultorio 5 Consultorio 6.,6062057,Privada,1
11,Bogotá D.C,11001,BOGOTÁ,1100128192,Visión medica de Ambulancias SAS,900657285,,CL 25 SUR # 69C 69,2607804 - 3132171133,Privada,1
11,Bogotá D.C,11001,BOGOTÁ,1100110006,SOCIEDAD DE SERVICIOS OCULARES SAS,800119574,NO,Carrera 16 No. 82 - 51 Piso dos,6181044,Privada,1
11,Bogotá D.C,11001,BOGOTÁ,1100103708,OPTILASER S.A,830020842,NO,CALLE 127 A # 7 - 53 OFICINA 4005 CONSULTORIOS 6002 - 6003 - 6004,7436009 - 3184941364,Privada,1
11,Bogotá D.C,11001,BOGOTÁ,1100111042,COORDINADORA DE SERVICIOS Y REPRESENTACIONES LTDA COORDISER LTDA,830050204,NO,AVENIDA CALLE 24 No 81 C - 79,3002139883 - 8054527,Privada,1
11,Bogotá D.C,11001,BOGOTÁ,1100119247,CORPORACION CLINICA RENAL COLOMBIANA,900002593,NO,CALLE 22 B No. 66 -46 CONSULTORIO 1209 -1210,2202700 EXT 71209,Privada,1
11,Bogotá D.C,11001,BOGOTÁ,1100125297,CLINICA LOS NOGALES SAS,900291018,,TRV 23 NO. 94A-39,2574474,Privada,1
11,Bogotá D.C,11001,BOGOTÁ,1100109116,FUNDACION CLINICA HOSPITAL JUAN N CORPAS Y CENTROS ASISTENCIALES AFINES,860055083,NO,Carrera 111 159 A - 61,6865014,Privada,1
11,Bogotá D.C,11001,BOGOTÁ,1100110251,FUNDACION NEUMOLOGICA COLOMBIANA,800180553,NO,KR 13 B # 161 85,7428900,Privada,1
11,Bogotá D.C,11001,BOGOTÁ,1100109629,LASER CENTER S.A,830023136,NO,CALLE 134 # 13 83,6271055,Privada,1
11,Bogotá D.C,11001,BOGOTÁ,1100117155,MEDICAL CORPORATION SOCIEDAD ANONIMA SIGLA MEDICAL CORP. S.A.,900136013,,CALLE 116 No. 71F - 18 - Barrio:PONTEVEDRA,3043972 - 3118441032,Privada,2
11,Bogotá D.C,11001,BOGOTÁ,1100105597,CAJA DE COMPENSACIÓN FAMILIAR CAFAM,860013570,NO,CRA 15 # 51 35,5550700 ext 12017-12015,Privada,1
11,Bogotá D.C,11001,BOGOTÁ,1100122153,INSTITUTO DE FERTILIDAD HUMANA SAS,900422248,,CALLE 124 NO 7 38 P 7 702,6190010,Privada,1
11,Bogotá D.C,11001,BOGOTÁ,1100123946,"FUNDACIÓN PARA LA INVESTIGACIÓN EN DERMATOLOGÍA - FUNINDERMA""",900410463,,carrera 15 No 95-35 Oficina 205,6163578,Privada,1
11,Bogotá D.C,11001,BOGOTÁ,1100119796,C Y R SALUD IPS SAS,830044563,NO,CRA 13 N 37-37 CONS 601-603-604-605-606-607-608-609,2321003-3016511824,Privada,1
11,Bogotá D.C,11001,BOGOTÁ,1100126941,BERGANDER SAS,900166501,,Calle 51 No. 27-11,4672323-4672322,Privada,1
11,Bogotá D.C,11001,BOGOTÁ,1100125162,CAMPO ELIAS PAEZ IPS SAS,900596903,,CARRERA 18 No. 84 - 11 CONSULTORIO 801,2960561/3102722788,Privada,1
11,Bogotá D.C,11001,BOGOTÁ,1100125654,GRUPO HOJA MEDICA S.A.S,900067918,,KR 15 # 83 - 33 PISO 4 Y 5,7456568 EXT 5001 Y 5002,Privada,1
11,Bogotá D.C,11001,BOGOTÁ,1100129153,Kaloni Colombia SAS,900852763,,AK 9 # 113 52 ED TORRES UNIDAS 2 LC 102,7456204 - 7456030 3103005690,Privada,1
11,Bogotá D.C,11001,BOGOTÁ,1100107646,CENTRO AUDIOLOGICO Y QUIRURGICO DEL COUNTRY SAS,830113069,NO,KR 16 A # 82- 46 CS 414 - 504 -610- 611 - 612 - 613 - 614,6160502,Privada,1
11,Bogotá D.C,11001,BOGOTÁ,1100112673,"FUNDACION PARA EL DESARROLLO FAMILIAR Y SOCIAL ""SEMILLEROS DE VIDA""",830134720,NO,Calle 186 Nº 7a-57,6788009,Privada,1
11,Bogotá D.C,11001,BOGOTÁ,1100117238,BIOMOLECULAR DIAGNOSTICA S.A.S.,900110259,NO,CALLE 102 A No. 45-46,6216563,Privada,1
11,Bogotá D.C,11001,BOGOTÁ,1100122886,FACSALUD & MEDISCHOOL LTDA,900296714,,KR 65 # 22 A 43 TORRE 4 APTO 203,3102749620 - 3182659554,Privada,1
11,Bogotá D.C,11001,BOGOTÁ,1100118931,E G FRESNEDA ODONTOLOGIA ESPECIALIZADA SAS,900223323,NO,CALLE 119 N° 14A-25 CONSULTORIO 502,6374637,Privada,1
11,Bogotá D.C,11001,BOGOTÁ,1100126767,ACOFOR LASER SAS,900346465,,CALLE 119 Nº 7 - 14 CONS 414 - 415,6297355 - 6297352 - 6203603,Privada,1
11,Bogotá D.C,11001,BOGOTÁ,1100120501,BOSTON MEDICAL GROUP DE COLOMBIA S.A.S.,900291373,,KR 10 # 97 A 13 OF 308 TO A,7446444,Privada,1
11,Bogotá D.C,11001,BOGOTÁ,1100128225,CRC FUTURO S.A.S sigla crc FUTURO,900762319,,Calle 161 A # 17 - 15,7436904 - 7436897,Privada,1
11,Bogotá D.C,11001,BOGOTÁ,1100107190,INSTITUTO DE REFERENCIA ANDINO S.A.S,800222660,NO,CALLE 13 # 60 49 PI 3,2900077,Privada,1
11,Bogotá D.C,11001,BOGOTÁ,1100111602,FUNDACION COLOMBIANA DE TERAPIA RELACIONAL FUNDATERAPIA,832002969,NO,CL 51 # 5 - 57 INTERIOR 1,2 32 13 46,Privada,1
11,Bogotá D.C,11001,BOGOTÁ,1100101751,ALARCON FORERO SOCIEDAD DE MEDICINA DEPORTIVA LTDA AF MEDICINA DEPORTIVA LTDA,830113969,NO,calle 106a No. 19 28,6372424,Privada,1
11,Bogotá D.C,11001,BOGOTÁ,1100132651,INNOVA RETAIL S.A.S.,900525521,,Calle 86 A N° 13 - 42,3143592257,Privada,1
11,Bogotá D.C,11001,BOGOTÁ,1100117735,ODONTOSALUD 80 SAS,900172412,,AC 80 #107-21 PI 2,4345348,Privada,1
11,Bogotá D.C,11001,BOGOTÁ,1100122186,INVERSIONES GRANDES IDEAS HOSPITALARIAS SAS,830102106,,CRA 22 No.74-31,2482750 2482797,Privada,1
11,Bogotá D.C,11001,BOGOTÁ,1100125320,ISH INTEGRAL SOLUTIONS IN HEALTH SAS,900601075,,KRA 26 39-27,3003051,Privada,1
11,Bogotá D.C,11001,BOGOTÁ,1100112756,ENDOTHERAPEUTICS SAS,830115566,NO,KR 13 # 49 40 CS 525,3383864,Privada,1
11,Bogotá D.C,11001,BOGOTÁ,1100125179,EVENTOS MASIVOS CIUDAD JARDIN SAS SIGLA EVENMAS SAS,900596884,,CRA 11 A N° 17 sur 34,4076342,Privada,1
11,Bogotá D.C,11001,BOGOTÁ,1100105681,FUNDACION HOSPITAL DE LA MISERICORDIA,899999123,NO,Avenida Carrera 14 No 1-65,3811970,Privada,1
11,Bogotá D.C,11001,BOGOTÁ,1100103119,CAJA DE COMPENSACION FAMILIAR DE CUNDINAMARCA COMFACUNDI,860045904,NO,CL 53 # 10 39 PI 2,3481248 Extension 202,Privada,1
11,Bogotá D.C,11001,BOGOTÁ,1100130008,INVERSIONES VASQUEZ MUÑOZ SAS SIGLA INVERSIONES V&M,900925121,,Diagonal 21 A No. 19-52 Sur,7522037- celular 3212427461,Privada,1
11,Bogotá D.C,11001,BOGOTÁ,1100120491,Inversiones Amarise SAS,900294802,,KR 14 # 78 44 PISO 2,7429394,Privada,1
11,Bogotá D.C,11001,BOGOTÁ,1100103694,UROBOSQUE S.A,830058292,NO,AC 134 No. 7- 83 TO 3 PI 6 MD 361,6482254 - 6272299,Privada,1
11,Bogotá D.C,11001,BOGOTÁ,1100120426,PASSUS IPS TALLER PSICOMOTRIZ S.A.S.,900308007,,CALLE 142 No 16A 52,7022156,Privada,2
11,Bogotá D.C,11001,BOGOTÁ,1100115668,NACIRA TURBAY J Y ASOCIADOS LTDA,830500253,NO,AV CLL 127 No 20-78 OF 407,6154637,Privada,1
11,Bogotá D.C,11001,BOGOTÁ,1100114757,CENTRO DE DESARROLLO INTEGRAL DE SALUD FAMILIAR JUAN PABLO II IPS SAS CON SIGLA CEDI SALUD FAMILIAR JUAN PABLO II IPS SAS,900031309,,CL 27 SUR # 18C- 02,3661905,Privada,1
11,Bogotá D.C,11001,BOGOTÁ,1100101579,SOCIEDAD PEDIATRICA DE LOS ANDES S.A.S - SPLA S.A.S.,830071938,NO,KR 19 # 84 -73/65,6107242 - 3182702761,Privada,1
11,Bogotá D.C,11001,BOGOTÁ,1100118405,UNIDAD CLINICA ODONTOLOGICA EL LAGO Y/O ROSA ELENA BARBOSA LEGUIZAMON SAS,900201905,NO,AV BOYACA No. 73 A 41,4309113,Privada,1
11,Bogotá D.C,11001,BOGOTÁ,1100108035,MEDLUCARA LTDA,800131264,NO,AK 20 # 80 - 77,6114020,Privada,1
11,Bogotá D.C,11001,BOGOTÁ,1100112713,ENDOCARE LTDA.,830128615,NO,"CL 106 # 54-60 CONSULTORIO 1, 2, 3, 4, 5, 7, 8, 9, 10",6132411,Privada,1
11,Bogotá D.C,11001,BOGOTÁ,1100113602,LABORATORIO DE PATOLOGIA Y CITOLOGIA ONCOLOGICA PALERMO S.A.S,830138056,,KR 23 # 45 C - 31 CS 202A Y CS 212,2875973,Privada,1
11,Bogotá D.C,11001,BOGOTÁ,1100100483,SALUD INTEGRAL EL LAGO LTDA,830014375,NO,CL 79 # 18 34 CS 506,8056234,Privada,1
11,Bogotá D.C,11001,BOGOTÁ,1100127490,EKILIBRARTE SAS - SIGLA: EKILIBRARTE IPS SAS,900696615,,Cra. 62 No. 97-82,2260025,Privada,1
11,Bogotá D.C,11001,BOGOTÁ,1100127499,DENTIVITAL SAS,900739115,,AC 72 #84A-48,2240947,Privada,1
11,Bogotá D.C,11001,BOGOTÁ,1100121238,BIENESTAR IPS S.A.S.,800223206,,Carrera 14 A No. 68 - 31,4873535,Privada,1
11,Bogotá D.C,11001,BOGOTÁ,1100128773,MEDICINA NUCLEAR DE BOGOTA S.A.S,900589109,,KR 20 Nº 62-09,7034991 - 7034982 - 3173651854,Privada,1
11,Bogotá D.C,11001,BOGOTÁ,1100114369,DENTAL ASSISTANCE SAS,830143831,NO,CL 125 NO 20-59 CS 204 y 205,5205251,Privada,1
11,Bogotá D.C,11001,BOGOTÁ,1100117894,CENTRO DE ORTOPEDIA Y TRAUMATOLOGIA UNICENTRO LTDA,900175697,NO,AK 15 NO. 124 47 OF 201-202-203-204-205-206-302-303-304-309-412-501,2140230,Privada,1
11,Bogotá D.C,11001,BOGOTÁ,1100105322,COMUNIDAD HERMANAS HOSPITALARIAS DEL SAGRADO CORAZON DE JESUS,860007760,NO,CRA 7 # 68 70,5870366,Privada,1
11,Bogotá D.C,11001,BOGOTÁ,1100113009,CENTRO DE REHABILITACION Y ESTÉTICA ORAL EU - CREO EU,830136033,NO,CALLE 57 Nº 21 - 26,(57)(1)2493888,Privada,2
11,Bogotá D.C,11001,BOGOTÁ,1100127101,AMBULANCIAS ANDAR PLUS SAS,900660001,,CALLE 74 No. 73 a - 51,5419584,Privada,1
11,Bogotá D.C,11001,BOGOTÁ,1100107648,CLINICA IZKA SAS,800172517,NO,CL 83 No. 19 36 PI 4o.,6160670 - 3133482590,Privada,1
11,Bogotá D.C,11001,BOGOTÁ,1100105098,CONTROLAR SALUD INTEGRAL S.A.S,830103479,NO,KR 45 A # 94- 91,7420428,Privada,2
11,Bogotá D.C,11001,BOGOTÁ,1100113172,FUNDACION ESENSA,830037741,NO,Cra 45A No. 103 16,6028312,Privada,6
11,Bogotá D.C,11001,BOGOTÁ,1100132304,INVERSIONES Y SERVICIOS GOMEZ MENDOZA SAS,901034656,,CL 119 No. 7 - 14 CONS 810,3203447775,Privada,1
11,Bogotá D.C,11001,BOGOTÁ,1100117586,BUITRAGO & AVILA LTDA,900161587,,AV 1 DE MAYO N° 52 A 96 SUR,4073398,Privada,1
11,Bogotá D.C,11001,BOGOTÁ,1100118477,ASISTENCIA CIENTIFICA DE ALTA COMPLEJIDAD SAS,900206215,NO,Calle 45B No. 24 - 25,5107600 - 3175097386,Privada,1
11,Bogotá D.C,11001,BOGOTÁ,1100127317,arcoiris de esperanza s.a.s,900738204,,KR 72A # 8B -62 int 2,3107732715/3143692116/8008323,Privada,1
11,Bogotá D.C,11001,BOGOTÁ,1100108627,FUNDACION AMAR,830074717,NO,CRA 73 # 73 90,4360864,Privada,1
11,Bogotá D.C,11001,BOGOTÁ,1100120735,IPS CENTRO ESPECIALIZADO EN ENFERMEDADES PULMONARES S.A.S. SIGLA IPS CEEP S.A.S.,900322195,,CL 134 # 7 83 CS 333,2743131,Privada,1
11,Bogotá D.C,11001,BOGOTÁ,1100128349,GRUPO J D OPTICAS S A S SIGLA OPTICAS JD S A S,900542496,,CRA 79 No. 8 A 05,2825621-2815175,Privada,1
11,Bogotá D.C,11001,BOGOTÁ,1100120414,CLINICA SANTA TERESITA DEL NIÑO JESUS S.A.,900211668,,KR 96 C # 21 A 43,2679173,Privada,1
11,Bogotá D.C,11001,BOGOTÁ,1100101580,CLINICA BELANOVA S.A.S,830029865,NO,CRA 18 # 85 36,12563627 1 2563627,Privada,1
11,Bogotá D.C,11001,BOGOTÁ,1100119267,CLINICA DE CIRUGIA PLASTICA DR YESID MARTINEZ LTDA,900237597,,KR 58 # 128 04,2266899,Privada,1
11,Bogotá D.C,11001,BOGOTÁ,1100120140,FUNDACION LEON ZAFIRO,900284507,NO,CALLE 23 D No. 82-16,2630402,Privada,1
11,Bogotá D.C,11001,BOGOTÁ,1100121434,RENE RODRIGUEZ MEDICAL SAS,900347752,,CL 110 # 9 25 CS 704 y 705,7552888,Privada,1
11,Bogotá D.C,11001,BOGOTÁ,1100108453,CLINICA COLOMBIANA DE OBESIDAD Y METABOLISMO SAS,830029172,NO,Kra 13 No 94A-25 Cons. 406 y 416,6224214,Privada,1
11,Bogotá D.C,11001,BOGOTÁ,1100130253,ESTEBAN BUSTOS SAS,900985622,,CR 19 No. 134 A 23,3099783,Privada,1
11,Bogotá D.C,11001,BOGOTÁ,1100128384,AMI PALLIUM COLOMBIA SAS,900642294,,CARRERA 71 F No 6B-22 LOCAL 1,3156284710-3156282040,Privada,1
11,Bogotá D.C,11001,BOGOTÁ,1100116864,SERVIVIR SERVICIOS MEDICOS INTEGRALES,830080224,NO,CARREA 71C No 3a-26,4140640,Privada,1
11,Bogotá D.C,11001,BOGOTÁ,1100117563,RADA CASSAB MEDICINA ESTETICA S.A.S.,830509599,NO,CL 109 No 18 C 17 CONSULTORIO 613,6202081,Privada,1
11,Bogotá D.C,11001,BOGOTÁ,1100126515,BUITRAGO SAS,900608580,,AK 30 No. 4 A 58,571 3702999,Privada,1
11,Bogotá D.C,11001,BOGOTÁ,1100109757,AAAA ACADEMIA ABSCRITA A ASOCIACION DE ESPECIALISTAS S.A.S,860074971,NO,AV CARACAS # 30 51,2323100/3114488055,Privada,1
